DocURL	DocID	SentID	LC	Match	RC	N2Num	N2Typ	N1Lemma	N1Pl	LE
http://www.produktlinks3.homepage.t-online.de/Bettueberwurf.html	6ed948b34700c84b63cb166d392c83a6f01f	26	Tagesdecke Steppdecke Quilt Patchworkdecke Bettüberwurf Laura Ashley ANGELIQUE Tagesdecke Bettüberwurf NEU Tagesdecke Bettüberwurf Tuch goa Backgammon 210x240 Ö 13 Tagesdecke Wandbehang Bettüberwurf Goa 2,05 mX 1,40 m Ö 67 Neuer Bettüberwurf + 2 Polster ca 1,90 x 1,71 Tagesdecke , Steppdecke , Krabbeldecke , Bettüberwurf NEU ! Bettüberwurf BROSIS Tagesdecke	Bettüberwurf	NEU 220x150 Tagesdecke Quilt Patchworkdecke Bettüberwurf 220x240 Tagesdecke Steppdecke Quilt Patchworkdecke Bettüberwurf Tagesdecke Bettüberwurf Tuch Goa Indien 210 x 245 cm Ö 19 riesige uralte Tischdecke ? Bettüberwurf ? RARITÄT Uralter feiner Bettüberwurf , Tüll mit Rosenspitze JUGENDSTIL BETTÜBERW URF.Maß e : 260 x 200 cm.WEI ß. Riesige Decke wohl Bettüberwurf 244 x 192 cm Steppdecke Quilt , Bettüberwurf Tagesdecke sand 220 x 240 IKEA * TAGESDECKE * DECKE * BETTÜBERWURF * HUSSE Laura Ashley Bettüberwurf - Bettlaken - rose / weiß kar .	Sg	Ind	Bett	en	0
http://www.bookmrk.de/benutzer/17387/lesezeichen	89512677ef0155bed34ad64d6dae9fc15249	45	Glanz liegt radikal in der Tendenz der Konsumenten , denn Satin-Bettzeug sieht nicht nur trefflich aus , sondern Bettwäsche aus Satin mindert auch , dass man unter ihr zu zu viel schwitzt - im Gegenteil , die glatte Oberfläche kann sogar ein ausgeglichenes Sentiment erregen . Joop-Living bietet in seiner aktuellen Bed Linen Kollektion ,	Bettüberzüge	aus gravitätischem Honan-Satin , sowie Mako-Satin und Jaquard-Satin . Hinzugefügt am 13.10.2011 - 13:31:5 7 - 4 Benutzer Webverzeichnis : Wasserbetten-Wissen Wohnungseinrichtung : Die Aufmachung kann beim Wasserbetten-Kauf bedeutsame Eigentümlichkeiten umschließen .	Pl	Ind	Bett	en	0
http://frame25.f-lm.de/Ausgaben/04_99/rezensionen.html	27d14ee4e9ec2abdf02248efa6f2a8a6ddec	47	Hierzu wurde nicht einfach die Audiospur der Fernsehserie getaped , sondern die Gags wurden eigens für die " audielle Rezeption " bearbeitet . So verstärkte man für den ( meiner Ansicht nach besten ) Sketch " Buying a bed " die Hintergrundgeräusche , die in der Fernsehepisode visuell realisiert wurden , so , dass es nicht notwendig ist , sich daran zu erinnern , wie sich der	Bettverkäufer	einen Papiersack über den Kopf zieht , als das Ehepaar in seiner Gegenwart das Wort " Matratze " ausspricht . Zu den insgesamt 19 Sketchen des Tapes zählen u.a. der " Lumberjack Song " , der " Dead Parrot Sketch " und " Arthur Two Sheds " .	Sg	Ind	Bett	en	0
http://schreiben-ist-magie.de/doerte/2010/02	9a01bc3c7a511116fee02af870884fb3a623	19	Todmüde und ziemlich duun im Kopf zog Mick seine Sachen und die unbequemen Boxershorts aus und warf sich aufs Bett . Die Kinoposter blickten auf ihn herab , als er nach der Kordel zum Zuziehen der	Bettvorhänge	suchte , sie in seinem Brand nicht finden konnte und schließlich aufgab . Quer über das Bett gelegt schlief Mick röchelnd ein .	Pl	Ind	Bett	en	0
http://blog.einfachnachhaltig.de/mission-impossible-von-4-500-auf-1-million-elektrofahrzeuge-in-8-jahren	09aa162f7df20e4687d05fa5068323863eae	9	In dem neusten Bericht kommt auch der NPE zu dem Schluss : Ohne ein mehr an staatlicher Förderung werden in 2020 maximal 600.000 E-Autos auf deutschen Straßen stromern . Die Kritik auf einen Blick : Prof. Dudenhöffer vom Center Automotive Research sieht die Fortschritte bei der Förderung der Elektromobilität durch die Bundesregierung als Flop und formuliert gewohnt griffig : " Die Nationale Plattform für Elektromobilität ist als Tiger gestartet und als	Bettvorleger	angekommen . " Laut Dudenhöffer muss man froh sein , wenn man bis 2020 noch 10 % des Ziels erreicht .	Sg	Ind	Bett	en	0
http://www.cornelia-b.de/falsch1.html	8022dac4a42d46c17999ac7ea3a1b619e642	123	Das tut die geschockte Mutter nicht , sie setzt sich an das Bett von Cornelia . Die Mutter ist nicht als	Bettwache	zu verstehen , sie sollte doch nach Hause gehen . Cornelia wird eine Eiskrawatte und Bettruhe sowie eine Nierenschale im Bett verordnet ( - Das Kind wird noch Blut erbrechen - sagt dieser Arzt der Mutter ) .	Sg	Ind	Bett	en	0
http://www.paulsmama.de/community/fragen/4/202	07b181c49e99cc38646ac3a1f2b6783496f5	2	Es ist schon echt schlimm , man kann nirgendwo hingehen , ohne ueber diese kleine amerikanische Super-Goere zu stossen . Schultaschen ,	Bettwaesche	, Poster ... ich kann es nicht mehr hoeren . Hoert das nie auf ?	Sg	Ind	Bett	en	0
http://www.schaedlingshotline.de/forum/schaedlingsbestimmung-bekaempfung-und-schaedlingsp-f2/bettwanzen-solfac-t1758.html	13c1d08745999b031023fdc5db207f57ae17	7	Das war am 7.5. . Es war dann auch erstmal nichts mehr , aber seit heute habe ich wieder Stiche und ich habe auch eine lebende ( erwachsene )	Bettwanze	auf meinem behandelten Lattenrost gefunden . Meine Frage ist nun ob der SBK gepfuscht hat und einfach mit dem Mittel gespart hat oder es noch eine gewisse Zeit dauert , bis alle Tiere tot sind .	Sg	Ind	Bett	en	0
http://www.schaedlingshotline.de/forum/schaedlingsbestimmung-bekaempfung-und-schaedlingsp-f2/bettwanzen-wie-einige-gefuellte-reisetaschen-entse-t1042.html	e069de7ed4910ce7786d9abe374547e8ff82	3	Bettwanzen : Wie einige gefüllte Reisetaschen entseuchen ? Moderatoren : Uli Lachmuth , Rüdiger , Grimmwart , ThomasK Seite 1 von 2 [ 26 Beiträge ] Gehe zu Seite 1 , 2 Nächste Vorheriges Thema | Nächstes Thema Autor Nachricht hd_bw Betreff des Beitrags :	Bettwanzen	: Wie einige gefüllte Reisetaschen entseuchen ? Verfasst : 27.09.2007 , 03:51 Registriert : 27.09.2007 , 03:31 Beiträge : 12 Hallo , zuallererst : Ich habe das Forum furchsucht , und viel über Wanzen gefunden - jedoch vor allem über Bestimmung .	Pl	Ind	Bett	en	0
http://www.matratzen-online-kaufen.de/nackenkissen	6c1b2f1ef2413947d9064823c32ec0ced71d	1	Du kennst mich gar nicht oder ? 4. Danke für alles , Ich liebe dich auch ; ) Array ( 1 week ago by blubbermomo ) @ClickForVids 1. Schade , aber auf alten Schiffen lernt man segeln ;) 2. Oh DOCH , das bist du :D 3. Hast du die Ahnung 4. : - * ♥ @ClickForVids lol . ( 1 day ago by AudiosurfingXtreme ) @ClickForVids lol . Einen Freund senden : Impressum | Kontakt | 66info.de | 66web.de | nahverkehr-info.de | 66top.de | tip1a.de Copyright © 2010 - 66info.de - Video Auswahl Portal die Kirche Wind pfeift durchs verlassene Gemäuer in den endlosen Gängen düster lange Schatten ähneln einem Ungeheuer es klingt nach wisperndem Geflüster vielleicht war es eine Kirche , vor ewigen Zeiten jetzt nur mehr eine Halle der Toten kann nur noch Schmerz und Angst verbreiten die beiden sind die einzigen Boten stumme Skelette liegen in Gängen ihre knöchernen Finger in Pein zerbrochen ihre Sinne schwarz wie ihre Körper dort hängen ihre Seelen in Furcht verkrochen zur einsamen Wache nur ein toter Leib nicht so gänzlich verrottet , noch mit schütterem Haar wartet auf seiner Seele verbleib auf daß die Hoffnung seinen Frieden bewahr der düsteren Hallen Duft riecht nach Tränen Inschriften in Grabsteinen vermessen wenn sie der Verstorbenen Namen erwähnen sind alsbald sie wieder vergessen Gewächse auf den weißen Steinen der Marmor wie die Toten verblichen als Andenken für die die Weinen vielleicht ein Unrecht ausgeglichen sehen die schweigenden Hallen jemals ein Gesicht wurden sie je gesehn tritt jemals wieder ein Fuß in die staubige Schicht wird der Schmerz jemals vergehn der Zeiten Nebel zu verwehn die Kathedrale zu erhellen muß Frühes Spätem widerstehn und stumme Totenschreie gellen zurück Matratzen , Naturmatratzen , Kaltschaummatratzen , Kindermatratzen - viele Testsieger ( Stiftung Warentest , Ökotest ) Lattenroste , Kissen ,	Bettwaren	zu günstigen Preisen . Home Ihr Konto | Merkzettel | Warenkorb | Kasse Katalog » Nackenkissen Kategorien Bettwaren Nackenkissen Federkernmatratzen Taschenfederkern - matratzen Kaltschaummatratzen Jugendmatratzen Kinder - Jugendbetten Kindermatratzen Latexmatratzen Viscoschaummatratzen Naturmatratzen Wasserbettmatratzen XXL Matratzen Lattenroste Lattenrost ( starr ) Lattenrost ( verstellbar ) Lattenrost ( elektrisch verstellbar ) Matratzenzubehör Getestete Matratzen Hersteller Mehr über ... Impressum Kontakt Widerrufsrecht AGB Liefer - und Versandkosten Privatsphäre und Datenschutz Rückruf Service Informationen Suchen Gästebuch Sofortüberweisung Über uns Lagerverkauf Sitemap Kindermöbel Blog Unser Kindermöbel Blog Ihr Warenkorb Sie haben noch keine Artikel in Ihrem Warenkorb .	Pl	Ind	Bett	en	0
http://www.feuerwehr-toeging.de/Einsaetze/Einsaetze_2011/069_20.10.2011/index.htm	f3f93f1ee75675ced0cd0dfc361208fb9bb1	1	Wer also Spaß und Abenteuer liebt und seiner Gesundheit etwas Gutes tun will , die / der melde sich für die Freizeiten vom 29. Juli bis 19. August oder vom 18. August bis 09. September ( Alter 8 & ndash ; 12 bzw. 12 & ndash ; 16 Jahre ) beim Diakonischen Werk in Sulzbach-Rosenberg , Pfarrgasse 5 an . Telefon : 09661 / 891 - 200 KASA ( Kirchliche Allgemeine Sozialarbeit ) Pfarrplatz 5 92237 Sulzbach-Rosenberg Telefon : 09661 / 87770 - 0 Brand durch elektrischen Bettwärmer Ein älteres Ehepaar wollte mit einem alten elektrischen	Bettwärmer	das Bett vorwärmen . Durch einen technischen Defekt des Bettwärmers fing allerdings die Matratze und das Federbett an zu brennen .	Sg	Ind	Bett	en	0
http://www.to-toskana.de/navico/lanticocipresso	dd90fc56454fab5790ac55ba6c4c6b3b51d4	23	Dieses Zimmer verfügt über ein niedrige , schräge Decke mit Holzbalken . Die Betten sind mit hochwertiger	Bettwäsche	bezogen , und auf dem Terracottafußboden liegen große Teppiche . Vom Haus aus haben Sie Blick auf die Hügel und Täler der Toskana mit Olivenhainen und Weinbergen .	Sg	Ind	Bett	en	0
http://www.ffsf.de/archive/index.php/t-7642.html	2abfbcc11ae5cbc5de96b1a9e45f629746f3	42	Dazu und zur Füllungsmaske empfehle ich , um die Anwendung bzw. Wirkungsweise zu vertehen , in die Bedienungsanleitung zu gucken . Bis morgen ,	Bettzeit	hier . Gruß , Ralf mgeiler 03.06.06 , 06:34:0 8 Hallo Sascha , wilkommen im Forum :) - Gibt es sowas wie einen Zauberstab ??	Sg	Ind	Bett	en	0
http://www.hausmed.de/gesund-leben/erholsamer-schlaf/grundlagen-fuer-einen-erholsamen-schlaf	60a4d1bbf62bb0471b71caef246a50047bc7	35	Außerdem sollten Menschen mit Schlafstörungen nicht länger als nötig im Bett verbringen . Häufig gehen Betroffene , mit der Annahme , längere	Bettzeiten	erhöhen die Chance auf mehr Schlaf , sehr früh ins Bett . Das lange Liegen führt jedoch eher dazu , dass das Bett unbewusst als Ort der Schlafstörungen aufgefasst wird , sich diese dadurch zusätzlich verselbstständigen und der Schlaf eher leichter und unterbrochen ist .	Pl	Ind	Bett	en	0
