DocURL	DocID	SentID	LC	Match	RC	N2Num	N2Typ	N1Lemma	N1Pl	LE
http://artikel5.forumprofi.de/thema-anzeigen-ruecktritt-aus-liebe-t4337-s15.html	c8f2098c97b50941c4dfd14b54d923a3a4db	21	Nebenher gesagt , sieht auch nicht aus wie ein " alter Sack " und manches Mädchen von 16 schon wie ne Frau von Ende 20 ! Für mich sind Politiker , die abtreten sollten , eher die -- die nebenher ein	Betthäschen	haben und Kinder außerhalb der eignen Familie zeugen -- wie Herr Seehofer & o . Zuletzt bearbeitet von pudelkatze am Di 16 Aug , 2011 06:41 , insgesamt 3 - mal bearbeitet Verfasst am : Di 16 Aug , 2011 06:00 Gast pudelkatze hat Folgendes geschrieben : hm , ich hab da ne ganz eigen Meinung dazu -- man kann mit 16 wohl lieben , und es muß auch keine " Pfauenverehrung " sein , als ich meinen Mann kennen lernte , war das kurz vor meinem 15 .	Sg	Ind	Bett	en	0
http://www.schlafen-aktuell.de/forum/fragen-zu-technik-zubehoer-pflege/t-hallo-und-elektrische-aufladung-5236.html	916e7f8d71ceebe946d491b827852c74fdf5	34	Hallo Solche Fälle gabs hier schon öfters zu lesen . In der Regel liegt es daran , sofern ich das richtig im Hinterkopf habe , das die Erdung der	Bettheizung	nicht mehr gegeben ist . Meist liegt der Fehler hier in der Steckdose selber oder deren Zuleitung .	Sg	Ind	Bett	en	0
http://www.leser-service.de/bookinist/content/text/xolds/book/@mihochz.htm	81538e2cb6c83c57fb8eeea18e34f0df83cc	20	Der Vogel richtete sich auf , breitete die Flügel aus , schlug einmal damit und glitt dann auf so straff gespannten Flügeln hinaus , als würden sie von einer Schnur gehalten . Sein runder schwerer Leib schwang sich empor und sie sah ihm mit klopfendem Herzen nach , bis der	Betthimmel	sich ins Blickfeld schob und ihr die Sicht auf den Vogel versperrte . S. 25 - 26 zitiert nach Susan Minot - Hochzeitsnacht Hochzeitsnacht Susan Minot - Hochzeitsnacht " Hochzeitsnacht " von Susan Minot ist ein leises , melancholisches Buch .	Sg	Ind	Bett	en	0
http://www.online-roman.de/haare01.html	3900b2154905b587a4ec69bd7e727c5c16c3	3	Etwas langsamer als sonst richtete sie sich auf , setzte sich auf die Bettkante , steckte ihre Füße in die Pantoffeln und rieb ihre Augen , die heute ein wenig müder waren als sonst . Dann stellte sie sich wie jeden Morgen kurz auf , raffte das lange Baumwollnachthemd über den Po und ließ sich auf die	Bettkante	zurückplumpsen . Dann zog sie das Nachthemd über den Kopf , faltete es sorgfältig zusammen und legte es neben sich auf die Bettdecke .	Sg	Ind	Bett	en	0
http://www.decido.de/suche-schlafsofa+mit+bettkasten.html	3618e994c03b9cc748471bd63099d6091156	19	im Lieferumfang inklusive sind zwei Rücken - und zwei Armlehnkissen . Mit Bettkasten Details zu Schlafsofa Lido 249,99 € Schlafsofa Victoria Entspannen Sie sich auf dem trendigen Schlafsofa mit	Bettkasten	. Die Besonderheit an diesem Modell liegt darin , dass das Sofa einen hohen Komfort bietet und geradezu zum Relaxen einlädt .	Sg	Ind	Bett	en	0
http://www.behsiris-heiligebirma.de/Wissenswertes/wesen.htm	6d40b647665886345bd6fbe7a44bcd482c7a	19	Trotz ihrer liebenswürdigen Art , können Birmchen sehr dickköpfig sein und manche von ihnen sind diffizile Esser . Außerdem werden fast alle Birmas	Bettkatzen	. Trotzdem ist sie eine richtige Katze , die eine gute Sprungkraft besitzt und gerne jagt , wenn sie die Möglichkeit dazu hat .	Pl	Ind	Bett	en	0
http://www.mein-mitteilungsblatt.de/schnaittach/marktplatz/action/page/2	9ae4933b52abadedba7993c2bcd4e5a3f05c	10	Um 11 Uhr findet im Eingangsbereich des Industriemuseums die offizielle Eröffnung durch den Landrat , als Schirmherrn , und dem 1. Bürgermeister ... Ausflug , Handel , Familienausflug , Industriemuseum , Gewerbeschau , Bund der Selbständigen , BDS Lauf , BDS LAUFWERK Industriemuseum , Laufwerk , Regionale Messe , Gewerbeausstellung 3 Bilder Büttner Wohndesign für jeden Anspruch Harald Büttner e.K. aus Neunkirchen a. Sand | am 07.03.2014 | 112 mal gelesen Neunkirchen : Büttner e.K. | Büttner Wohndesign in der Hauptstraße 1 - 3 in Neunkirchen a.S. hält für Sie Traumküchen und	Bettkultur	vom Feinsten bereit . Was 2004 als Küchenstudio begann , wurde im Jahr 2008 um eine große Präsentation für Schlafsysteme und Matratzen erweitert .	Sg	Ind	Bett	en	0
http://www.historische-eschborn.de/berichte/eschborn/Stephanshof/body_stephanshof.html	e40e04b08044c87af320ac3eb92e4744f2fa	82	Dann soll er vorfinden eine verschließbare Kammer , damit er sich darin mit seinen Freunden besprechen kann . In der Kammer soll er eine	Bettlade	mit zwei weißen Linnentüchern vorfinden , daß er ruhen könne , wenn er müde wird , und bei dem Bett sollen sitzen zwei Knechte , einer zum Haupt , der andere zu Füßen . Der zum Haupt soll französischen Wein , der zu den Füßen soll Hauswein haben , daß der Vogt sich laben könne , falls ihm wunderlich würde .	Sg	Ind	Bett	en	0
http://www.filmtrip.de/vember-und-der-trailer.html	eade9616f8e34889286c26932c757d9ccf0d	6	Im nachhinein könnte man sagen das bei der 2.30 Minuten Projektion so einiges schief lief . In den ersten 20 Sekunden gab es nur sehr leisen Ton , das war auch nicht so schlimm da helle Lampen noch auf die " Leinwand " ( ein putziges	Bettlagen	) strahlten . Danach gab es kurz lauten und dann sofort gar keinen Ton mehr .	Sg	Ind	Bett	en	0
http://www.blimb.de/webverzeichnis/c,1831,s,21.html	5634ca2a77feb5c59b908ca71a5020b53090	11	Gemütliche und dekorative Schlafzimmereinrichtungen auf der Bettwäsche-Seite . Z.B. Bettbezüge bzw. alle Arten von Spannbettüchern ,	Bettlaken	oder Matratzenbezüge . Previous 1 2 3 4 5 2727 Webseiten in 2075 Kategorien Links : Wasserstrahlschneiden | Ferienwohnung Nordsee | Webverzeichnis Kroatien impressum Powered by Free PHP Directory Script © 2011 Directory Search Kea Bergpapagei ( Kea ) Kea Mountain Parrot Nestor notabilis Papagei , Berg - ( Kea ) Parrot , Mountain Kea Allgemeines , Fortpflanzung , Aussehen Allgemeines Der Kea ( Nestor natobilis ) lebt in den Gebirgsketten im Süden Neuseelands .	Pl	Ind	Bett	en	0
http://www.galerie-muensterland.de/programmvorschau08/ausflug-3.html	78dcdb996b87cec5a84c7992b83ca3a7dac5	70	Der genetische Code , der uns eindeutig identifizierbar macht . Das Ich des Künstlers archiviert in den Fasern des	Bettlakens	, das als Bild angelegt wird . Auch Axel Schulß , der als Gastkünstler die Gruppe komplettiert , macht sich selbst zum Thema , in einer Serie von Selbstporträts , die mit einem Nagel durchschlagen sind : der Nagel im Kopf als Metapher für das Unabwendbare , das Schicksalhafte , das unser Leben von einem zum anderen Moment auf den Kopf stellt .	Sg	Ind	Bett	en	0
http://www.wodanserben.de/board/tochter-erschl%C3%A4gt-mutter-mit-kruzifix/thema3143.html	962ffe25d6d2f2e97b19dab919af9f2c18b9	7	Das Drama ereignete sich in der Nacht zum Montag . Aus ihrem Wahntraum erwacht , schlug die Frau demnach zunächst mit einer Nachttischlampe , anschließend mit einer	Bettlatte	und schließlich mit einem Kreuz auf ihre schlafende Mutter ein . Anschließend alarmierte sie die Rettungskräfte , die nur noch den Tod der 81 - Jährigen feststellen konnten .	Sg	Ind	Bett	en	0
http://www.saniermit.de/shop/Pflegebetten%3A%3A%3A25.html	f5a4f376e28a42bb4628df76ec0652501e83	2	Ihr Warenkorb ist leer . Willkommen zurück ! Mehr über ... Zahlungs - und Versandbedingungen Privatsphäre und Datenschutz Unsere AGB Impressum Kontakt Widerrufsrecht Informationen Sitemap Zeige 1 bis 16 ( von insgesamt 16 Artikeln ) Seiten : 1 Bett in Bett System Andrea Die Möglichkeiten für den Einsatz des fünfmotorigen	Bettliftes	sind gross . Passend zu den meisten ettumrandungen kann ein bestehendes Bett mit dem Andrea Bettlifter einfach erweitert werden .	Sg	Ind	Bett	en	0
http://www.kitticat.de/archive/index.php/t-5454.html	f56fe6e01027467b3ea5f6ae59d3e1a282be	297	Marlen Den Beitrag finde ich richtig gut . Jawoll ja :applaus: :applaus: :applaus: LG felidae Baty 02.04.2009 , 15:12 Hallo Wir habe vor vielen Jahren unseren	Bettmann	aus unserem allerersten Wurf damals mit ca 2 Jahren an einen " alten Herrn " gegeben , dem kurz zuvor sein Sibikater gestorben war . Der " alte Herr " war zu diesem Zeitpunkt 85 !!!	Sg	Ind	Bett	en	0
http://www.wellnessing.de/tag/fruhjahr	9123fa41af3a22b00c439c535c8e3bc4e3b6	42	Halten sie aber das ganze Jahr über an , dann können winzige Tierchen dafür verantwortlich sein : Hausstaubmilben . Sie leben mit dem Menschen sehr eng zusammen , etwa in	Bettmatratzen	, Teppichen und Sofas und ernähren sich von dessen Hautschuppen . Am wohlsten fühlen sich die Plagegeister bei hoher Luftfeuchtigkeit und warmen Temperaturen .	Pl	Ind	Bett	en	0
http://www.lignumnatura.de/de/Modellbezeichnungen	2ca8c25b09519c03aa8ee48066cc9ed2f1f8	117	Das klassiche Modell Fulcrum wurde neben einem Betthaupt des Duo auch mit 2 Ablagen am Kopfende ausgestattet . Ligna Cubilis Unio bildet die Grundlage für eine weitere Serie von unseren	Bettmodellen	. Ein typisches Futonbett mit keilverzinkten Lagerhölzern .	Pl	Ind	Bett	en	0
http://www.dielyriker.de/archive/index.php/t-12089.html	9204f8084fbe0b676f15106df6d520880d2f	47	Und ich erhoffe mir ein wenig davon , dass ein Kindersatz fällt wie z.B. " Boar das ist voll gemein von dem Papa " bzw. wahlweise auch " ... von der Mama . " Das wäre dann ein guter Ansatz gemeinsam darüber nachzudenken was man den sonst noch so gegen	Bettmonster	unternehmen könnte , bevor in letzter Konsequenz tatsächlich das Monster samt Bett verschwinden muss D. Ich denke über das " ihm " noch mal nach . Ich bin mir da gerade unschlüssig :confused: .	Pl	Ind	Bett	en	0
http://forum.prostatakrebs-bps.de/archive/index.php/t-6508.html	f6c700121d17cd117499666be727c4baeea1	5	uriblank ( uriblank ) Der Rat Uwe Peters , aus eigenem Leid und unguter Erfahrung mit den ihn behandelnden Aerzten erwachsen , verspricht zwar ein laengeres Leben und den Erhalt von Lebensqualitaet , aber er schuetzt uns nicht vor Fehlern , die wir selber machen und befreit uns auch nicht von Zweifeln und Aengsten . So kommt es , dass im Hospital der	Bettnachbar	im Vertrauen auf Gott und die Urologie und in Unkenntnis von Alternativen ergeben in sein Schicksal die Prostatektomie durchlebt und durchleidet , waehrend der " GURU " keinen Schlaf findet , weil er staendig ueber Sinn und Richtigkeit seiner Entscheidungen nachdenkt . Als ich im November 2009 bei einem PSA-Wert von ueber 10 ( unter Proscar ) Beschwerden mit der Blasenentleerung bekam , glaubten ich und der mich damals behandelnde Urologe zunaechst an eine gutartige Prostatavergroesserung .	Sg	Ind	Bett	en	0
http://lebensfreude.phpbb8.de/archive/t174.html	b297cbc226a4d7db0ddfe2528fb06f10d59a	15	Eines Tages : " Mama , machst du mir bitte eine Milch stubenrein ? " 31.07.2009 07:50 Running gag : Im Wochenbett hatte ich eine blutjunge deutsche	Bettnachbarin	( 17 ) , die sich noch mit den Wehen einer gruseligen Irgendwie-nicht-richtig-Lage quälte und dabei grausame Rückenschmerzen hatte . Sie war hochtoupiert und platinblond gefärbt , hieß aber trotzdem Carmen .	Sg	Ind	Bett	en	0
http://www.kulturwest.de/film/detailseite/artikel/take-it-uneasy	1e442c874f1d940d8935dbb26495719839ba	43	Mutter Martha ist HIV-infiziert und todkrank . Sie und die jüngere Claudia waren	Bettnachbarn	im Krankenhaus . Kurzerhand wird Claudia eingemeindet und in den Haushalt integriert .	Pl	Ind	Bett	en	0
http://www.apogepha.de/de/gesundheit/ratgeber/der-aktuelle-gesundheitstipp/gesundheitstipp-artikel/article/1199/hausapotheke.html	61dcf9061c889405d6219453a3c0fdfdef9a	7	Seelische Probleme sind hingegen sehr selten der Grund für das Bettnässen . Kinder , deren Eltern ebenfalls	Bettnässer	waren , sind häufiger betroffen . Neben der Beratung und richtigen Auswahl geeigneter Behandlungsmethoden beim Arzt ist in erster Linie auch Verständnis gefragt .	Pl	Ind	Bett	en	0
http://tirol.orf.at/news/stories/2520245	84814d624e0c6ac4419be8696ba9b5749bfe	15	" Sie äußert auch sehr oft die Frage , ob diese Kinder jemals vollwertige Menschen werden können . " Die Psychiaterin und Pädagogin , die bis 1987 Leiterin der Kinderpsychiatrie war , habe auch den erzieherischen Umgang mit Heimkindern in Tirol geprägt : etwa Bestrafungen und brutales Bloßstellen von	Bettnässern	gegenüber anderen Kindern , Klingelbetten gegen Bettnässen - auch noch zu einer Zeit , als anderswo humanere Methoden angewandt wurden . Zeitgebundene Problematik Hartmann Hinterhuber , bis vor kurzem Psychiatrie-Chef in Tirol , sagte gegenüber dem ORF , für ihn sei die angebliche Anwendung von Röntgenstrahlung völlig unverständlich .	Pl	Ind	Bett	en	0
http://www.cinemusic.de/2005-3632-napola	d501f07d012acfeccd91918d0315e66d314d	47	Die Darsteller-Infos sind zwar in visuell gefälligem Rahmen präsentiert , aber ohne Adleraugen schwierig zu entziffern . Interessant sind die rund 17 Minuten an geschnittenen und alternativen Szenen : Besonders die merklich anders angelegte Alternative zur Demütigung des	Bettnässers	ist sehenswert . Hier wird der Unglückliche vom Ausbilder Preiner ( Michael Schenk ) in klassisch autoritärer Anbrüller-Manier zur Sau gemacht .	Sg	Ind	Bett	en	0
http://www.sri-lanka-board.de/archive/index.php/t-11576.html	7c3286c5d7ba64f7694e25d0ab018d64e5d8	398	Und das meine ich garantiert nicht böse ! Wer soviel Spaß mit einer	Bettpfanne	hat kann doch garnicht böse sein und hat auch nur kleine Ansprüche im Urlaub . Ehe nun aber Nachfragen kommen : eine Bettpfanne hat bisher nicht dazu gehört .	Sg	Ind	Bett	en	0
http://www.leser-service.de/bookinist/content/text/xolds/book/@mihochz.htm	81538e2cb6c83c57fb8eeea18e34f0df83cc	12	Es kam langsam auf sie zu und das Zimmer blieb neutral . Die	Bettpfosten	hatten wie Kiefernzapfen geschnitzte Spitzen , der schmale Sekretär war zugeklappt , der Schlüssel steckte und auf der Kommode standen die Fotos ihrer Kinder , in rechteckigen oder ovalen Silberrahmen aufgereiht . Auf zwei Seiten gab es Fenster , zur Birke und dem hohen Zaun mit Speerspitzen hinaus , der die Grenze zwischen ihrem und dem Nachbargrundstück bildete , und gleich neben ihr das mit Blick auf den hinteren Garten und den Rasen , und die ganze Zeit über fühlte sie , wie die leise tuckernde Maschine unter ihr unablässig Schmerz produzierte .	Pl	Ind	Bett	en	0
http://www.radiaesthesieverband.at/index.php?thid=24%26subbid=fuenf	e7dc5576c9fc4bb3db3148e2e93e13003c0e	119	Rückblick auf die Frühjahrstagung in St. Virgil / Salzburg Ing. Herbert STRASSER Das Kraftfeld der Steine - Ergebnisse von radiästhetischen Untersuchungen 3 . Teil DI . Hartwig FRITZE	Bettplatz	des kleinen Mathias Hans KAUER Verhaltensprävention - Verhältnisprävention . Neue Wege in der Gesundheitsvorsorge Klaus BRUDNY , Kierling Risikofaktor Standort - Rutengängerzone und Mensch Univ .	Sg	Ind	Bett	en	0
http://www.blockstelle.de/reisetschech2004.html	4345e91a731ed837a3902298ecaef4e7988f	24	Der Fairness halber sei aber gesagt , dass im Obergeschoss von " McBrk " noch ein richtiges Restaurant eingerichtet ist . Ziel unserer Tagesetappe für heute soll der Hauptbahnhof in Pilsen sein , ab wo wir um 20.46 Uhr als einzig getätigte Reisevorbereitung	Bettplätze	für den Schlafwagen Cheb - Breclav ( - Wien ) reserviert haben . Wegen der wechselhaften Wetterlage wollten wir damit für den Folgetag zweigleisig fahren : Bei schönem Wetter auf Eisenbahntour durch Mähren gehen , bei schlechtem Wetter - etwa so wie heute - von Breclav aus einen Tagesausflug nach Bratislava oder Wien machen .	Pl	Ind	Bett	en	0
http://www.anyseek.de/web/Einkaufen/Online._.Einkaufen-175-8.htm	a52a7265e819a6ead6fb7c8fbf61dc3df1e6	29	Matratzen mit den verschiedensten Beruhigungen finden Sie in der Auswahl .	Bettrahmen	von Hasena , über De Luxe Leintücher von Kirsten Balk . Alles was Ihr Herz begehrt .	Sg	Ind	Bett	en	0
http://www.sonntagshorn.de/Themen/HHBT01.htm	8a981cdaafc66ca5f2fa34c6055170e04146	31	Gorey , Edward : Die blaue Stunde . Zürich : Diogenes , 1981. [ L ' heure bleue ] Aus d. Amerikan von Jörg Drews , Übs 37 S. Hagn , Hugo : Die blaue Stunde 10 Geschichten auf dem	Bettrand	zu erzählen . Berlin : Ohlert , 1949. 79 S. Heyduck-Huth , Hilde : Die blaue Stunde .	Sg	Ind	Bett	en	0
http://sz-magazin.sueddeutsche.de/texte/anzeigen/41817	a2bacefbcc0715ea2b718bb9930b002e3354	25	Natürlich haben wir alle Tricks versucht : Es gibt lange Schaumstoffwürste , die , würde man Aufschnitt draus machen , wie ein " T " aussähen . Man klemmt sie in die	Bettritze	. Diese Dinger haben nicht nur fürchterliche Namen ( Liebesbrücke , Ritzenfüller ) , sie funktionieren auch nicht : Sie drücken sich so fest in die Ritze , dass die Kluft einfach noch ein bisschen dramatischer wird .	Sg	Ind	Bett	en	0
http://www.alles-zur-allergologie.de/forum/discussion/269/kuhmilch-und-huehnereiweissallergie-bei-3jaehrigem	73beca39fa8ee1702d411a8bb9e72c9b6201	23	Sollen wir noch mal testen lassen ? Er hat keinen Teppichboden in seinem Zimmer , ich wische regelmäßig feucht Staub und wasche alle 4 Wochen seine	Bettsachen	. Können die Polypen auch mit den ständigen Erkältungen zusammenhängen , früher hatte er ja keine Probleme damit und was raten sie uns , sollen wir die OP machen lassen oder lieber noch abwarten ?	Pl	Ind	Bett	en	0
http://www.allergie-milben.de	9536800780cc536bd3e798b72f3600a9ae19	28	Kriterien für geeignete Mittel und Produkte . Anleitung zur	Bettsanierung	, Kaufkriterien für Staubsauger , Luftreiniger zur effektiven Reduzierung von allergenem Hausstaub ... Allergenreduzierung ... Matratzenreinigung Chemiefreie Reinigung der Matratzen vor Ort .	Sg	Ind	Bett	en	0
http://www.gesundheitsnetz-deutschland.de/pflege-und-soziales/Bayern/Dingolfing-Landau/Reisbach.html	a11503f1b4425053423a354169b4e911849a	44	Sie übernehmen die Einrichtung von Wohnräumen für die Betroffenen , wie z.B. die Einrichtung des Krankenzimmers . Dazu gehören je nach Bedarf , ein Krankenbett , Nachtstuhl oder	Bettschüssel	. Des Weiteren werden Maßnahmen der Hygiene wie die Entsorgung von z.B. gebrauchten Einmalartikeln wie Spritzen und Kanülen durchgeführt bzw. die persönliche Medikamentenversorgung gewährleistet .	Sg	Ind	Bett	en	0
http://www.inkontinenzberater.de/Wissenswertes-Inkontinenz-im-Alter.htm	60931362927ea693db46dd36da5ec226108c	33	Andererseits gibt es auch viele Menschen , die Inkontinenz nicht kennen . Manche lösen ihr Problem durch kleine Kniffe , wie eine geringere Trinkmenge , Bettflaschen oder	Bettschüsseln	, schwache Beleuchtung im Schlafzimmer , um die Toilette sicher und schnell erreichen zu können . Versuchen wir nun diese Alterungstheorie auf die Harnblase zu übertragen Eine Verminderung der Zellzahl und deren schlechteres Zusammenspiel führt dazu , daß die Blase steifer und weniger dehnbar wird .	Pl	Ind	Bett	en	0
http://www.liege-komfort.de/faq_gesund.html	3013ef600257f2637b139ec77fa4e097d03b	8	Sie schlafen ruhig und störungsfrei . Entspannende Wärme Wasserbetten sind durch ihre Heizung an das individuelle Temperaturempfinden optimal anpassbar - und zwar für jede	Bettseite	getrennt . Bereits beim Schlafengehen hat das Bett eine angenehme Temperatur .	Sg	Ind	Bett	en	0
http://presse.ebay.de/pressrelease/1960	b090eb71f1fdb0cef0bceaedd0a219113fd2	24	* Aktuelle Angebote im eBay-Fußball-Fanshop ( Stand 17.08.2010 ) * * Verkaufsdaten erhoben auf Terapeak.de am 17.08.2010 in den Kategorien Sport und Fußball . Beobachtungszeitraum 13.05. bis 10.08.2010 Die " WOW ! Angebote des Tages " : Siemens Telefon und 2 - teiliges	Bettset	Nur am heutigen Dienstag , dem 24. August gibt es das schnurlose Siemens Gigaset SL 780 Telefon für 89,99 Euro und das zweiteilige Mikrofaser Bettset für 15,95 Euro . Elegant telefonieren - Mit attraktiven Leistungsmerkmalen , hochwertigen Materialien und edlem Design überzeugt das innovative Gigaset SL 780. Mit Bluetooth® Headset - und Mini-USB-Anschluss ausgestattet macht das exklusive Telefon das Festnetz-Telefonieren besonders angenehm und komfortabel .	Sg	Ind	Bett	en	0
http://www.einrichtungsforum.de/bettsofa-mit-fester-lehne-t4780.html	c4ea7c3d2b27de8a1f084c13e2cea734db61	22	Hallo ich bin auf der Suche nach ... VERKAUFE BETTSOFA " DIE COLLECTION " INTRO ) BERLIN ( VERKAUFE :	Bettsofa	" die Collection " NP 2740 - Abholung ... Einrichtung Einrichtungsforum.de 2011 • Alle Zeiten sind UTC • Impressum Übersicht Imi Insignien " Is et wohr ? " Imi Imi ist eine in der Karnevalszeit gern benutze Bezeichnung für all jene Menschen , die vermeintlich nicht zu den Original-Kölnern gehören .	Sg	Ind	Bett	en	0
http://www.sessel-manufaktur.de/hochwertige-schlafsofas.html	855478481772eee303d85f5b68685ecaa19c	7	Gute Schlafsofas verfügen daher über eine Matratze aus Kaltschaum , die punktelastisch nachgibt und daher auch bei regelmäßiger Verwendung ein gutes und rückenfreundliches Liegen ermöglicht . Zudem ist Kaltschaum kaum milbenanfällig , weswegen	Bettsofas	mit Kaltschaummatratze ideal für Allergiker geeignet sind . Selbstverständlich ist bei hochwertigen Schlafsofas der Kaltschaum nachweislich schadstofffrei .	Pl	Ind	Bett	en	0
http://www.barbara-ricken.de/buecher-klaras-geschichte-leseprobe.php	466959f5563b2c65907cee21b1d2ae62c127	26	Die Großeltern sind schon vor ihnen da , Grafschaft Bentheim hört sich ganz gut an . Eine weitere	Bettstelle	kommt an die Wand , ein Strohsack wird hereingetragen . Die Küche ein länglicher , finsterer Raum , zum Klosett auf dem Hinterhof müssen sie auf die Straße hinaus und zwischen den Häusern die hohle Gasse nehmen .	Sg	Ind	Bett	en	0
http://agso.uni-graz.at/marienthal/archiv/lazarsfeld_paul_felix/nachlass_paul_lazarsfeld/04_t.htm	6939fbe53899352dbe1185b3556a801be7c4	10	Gemeindewohnung : die Tatsache , dass die Familie nicht zusammenlebt , in Untermiete lebt , etc[etera] , gesondert vermerken . 6 ) Zahl der	Bettstellen	: Hierbei kommt es nicht darauf an , ob es Bett , Sofa oder anderes ist ( auch Kinderwagen oder Wäschekorb gilt als eigene Schlafstelle ) , sondern es soll festgehalten werden , ob jede Person ihre eigene Schlafstätte hat oder mit wem sie sie teilt . 7 ) Reinlichkeit hier ist zu versuchen , den allgemeinen Zustand von Wohnung und Kleidung zu charakterisieren .	Pl	Ind	Bett	en	0
http://www.reiseservice-nothaft.de/ci.htm	b855f9e070b2d3221da4fcb0bb04f0de0fd2	9	Der neue X-Til , das erste Wohnmobil mit Hubbett , bei dem man gleichzeitig kochen , essen und schlafen kann * . Das Bett kann auf zwei Höhen eingestellt werden und teilt so die Räume : Wenn die Dinette genutzt wird - selbst in der niedrigen	Bettstellung	- hat man trotzdem Bewegungsfreiheit bei der Küchenarbeit . So können die Innenräume von allen dynamisch und funktionell genutzt werden .	Sg	Ind	Bett	en	0
http://www.promicabana.de/twilight-breaking-dawn-fsk-18-was-meint-ihr-umfrage	687d06922a272c672dce819fd8f680fa6942	24	ich persönlich fände das wirklich schade . Es geht ja nicht nur um die	Bettszene	, sondern auch um die Geburt . Ich hoffe , dass die Fimmacher hier mal über ihren Schatten springen und sich 1 zu 1 an das Buch halten .	Sg	Ind	Bett	en	0
http://www.phantastik-news.de/modules.php?name=News%26file=article%26sid=5736	4b396e7ac56893861c6d42019c010c0fa053	82	Dann kommen vielleicht ein netter Mann zusammen , der gern wissen möchte , was der Frau gefällt , und eine Frau , die das nicht beantworten kann , sich dessen schämt und irgendetwas mitmacht , weil sie denkt , er weiß , wie es geht . " In	Bettszenen	entdeckt also Evelyn ihre eigene Leidenschaft , lernt zu verstehen , was ihr gefällt und was nicht . Sie entwickelt sich dabei als Charakter ein wenig weiter , was auch die Handlung voranbringt .	Pl	Ind	Bett	en	0
http://www.baby-weingart.de/Bettausstattung/Bettwaesche-100-x-130%3A%3A%3A49_79.html	bab55a8ff7ce9ff05ef2f9ab0158188345f9	5	Bei dem patentierten DreamTubes™ handelt es sich um ein Spannbetttuch aus Baumwolle , in dessen seitliche Taschen aufblasbare Röhren gesteckt werden können , um Kinder zu beiden Seiten vor dem Herausfallen zu schützen . Sie können entweder das Set (	Betttuch	weiß mit 2 integrierten Röhren + 2 atoxische PVC Schläuche ) oder aber das Ersatz Betttuch einzeln kaufen . ab 26,99 EUR Odenwälder BabyNest Bettwäsche Mausi Serie Mausi Natur 100 x 135 cm + 40 x 60 cm 100 % Baumwolle 59,99 EUR Lieferzeit : 5 - 10 Tage Odenwälder Bettwäsche Elefant Modell Elefant mit Biese , bestickt 100 % Baumwolle in 5 Farben erhältlich Gr. 100 x 135 cm + 40 x 60 cm 37,99 EUR Odenwälder Bettwäsche Eule Elly passend zur Odenwälder Babynest Serie Eule Elly Gr. 100 x 135 cm + 40 x 60 cm 49,99 EUR Odenwälder Bettwäsche Fische mit Reißverschluß Odenwälder Bettwäsche Hardy passend zur Odenwälder Babynest Serie Hardy in 3 Farben erhältlich Lieferzeit : 1 Woche Pinolino Bettwäsche Pinos Spielewelt vanille 60 Grad waschbar Größe : 100 x 135 cm und 60 x 40 cm Geprüft nach Öko-Tex-Standard 100 34,99 EUR Pinolino Wende Bettwäsche Glückspilz Wendebettwäsche rosa oder blau mit weißen Punten süße Fliegenpilz Applikation Material : 100 % Baumwolle Schnullerbacke Bettwäsche Blumenfee Material : 100 % Baumwolle 19,99 EUR Zeige 1 bis 10 ( von insgesamt 10 Artikeln ) Seiten : 1 Ihr Warenkorb ist leer .	Sg	Ind	Bett	en	0
