DocURL	DocID	SentID	LC	Match	RC	N2Num	N2Typ	N1Lemma	N1Pl	LE
http://dirtypictures.phpbb8.de/filmtagebucher-f28/reggie-filmsucht-vom-italowestern-bis-zum-mainstream-t246-525.html	35ad007796632e84de9dad11d70da44a7f1a	243	Tina Aumont ist sehr hübsch , gibt die Carmen mit hingabe ! Franco Ressel hat auch ne typische Rolle inne als schmieriger Vorgesetzter , der auch auf die Carmen steht , nicht wegen der liebe sondern wegen der	Bettabenteuer	... Kinski als Ehemann , auch nur ne nebenrolle ist wieder mal nen skrupelloser Kerl , nen besseren für die rolle gibts nicht !	Sg	Ind	Bett	en	0
http://www.thiesen-divers.de/Thailand.htm	35723654b61670769185cd89168bcb2c1518	32	Frühstück inkl. Taxes 2 Kinder bis 12 J. o . eigenen	Bettanspruch	im Zimmer der Eltern kostenfrei . Transfers vom Flughafen Phuket , Krabi oder vom Lanta Pier sind vorab buchbar !	Sg	Ind	Bett	en	0
http://www.diebandscheibe.de/wissen/37-wissen/124-lattenrost-einstellung.html	3977732614b17b906452db18d600f219822c	22	Auch gibt es diese Kopfkissen in verschiedenen Härtegraden . Die Stiftung Warentest , sowie Ökotest haben Matratzen und Kopfkissen schon des öfteren getestet und geben auch Hinweise zu Schadstoffen , die viele	Bettartikel	immer noch aufweisen . Also lohnt sich vor dem Kauf auch der Besuch einer Beratungsstelle .	Pl	Ind	Bett	en	0
http://www.matratzen-wasserbetten-betten.de	6fa4432f7081326fadefd763cf6572ab4821	11	Allerdings zeigte sich auch der Trend , dass nicht alle Matratzen Arten und Preissegmente gleichermaßen betroffen waren . ( more ... ) ... posted under Matratzen | Comments Off Mit der Bettauflage DorMed slim im Schlaf abnehmen Juli 4 Eine neue	Bettauflage	ist auf den Markt gekommen , die das Abnehmen im Schlaf garantieren soll , die Rede ist hierbei von der Bettauflage DorMed slim . Mit einer Größe von 60 x 50 Zentimeter kann die Bettauflage in jedes Bett integriert werden , die von dem Unternehmen DorMed tds angeboten wird .	Sg	Ind	Bett	en	0
http://www.produktlinks3.homepage.t-online.de/Bettauflage.html	b816ba909c41c875f438ed95ac40ba266019	2	Bettauflage , 70x140 70 x 140 cm MEHR INFO EURO 129,00 Größe : 70x140 cm Menge : 1 2 3 4 5 6 7 8 9 10 Bettauflage , 80x160 80 x 160 cm MEHR INFO EURO 160,00 Größe : ... uriblank BETTAUFLAGE BETTAUFLAGE Auf Bestellung können Bettauflagen gefüllt mit Reinem Wollvlies , geliefert werden :	Bettauflagen	: Dimension(cm) kg Fr 70 x 140 0,900 58 90 x 190 1,500 98 90 x 200 1,600 120 100 x 200 1,750 135 120 x 190 1 ... VITALUSmedical --- Healthcare Company Bettauflage mit 144 Zirkularmagneten mehr Infos ... natürliche Magnetkraftfelder mit patentierter bioenergetischer Tiefenwirkung zur permanenten Anwendung VITALUS medical ... für mehr ... Lammfell.de -- Produkte -- Schlafen & Wohnen -- Lammfelldecke ...	Pl	Ind	Bett	en	0
http://www.bettenhaus-heber.de/bettwaesche.html	9e800203ae26a426e0c744191b882b06a329	2	Beim Einkauf hochwertiger Bettwäsche für unser umfangreiches Sortiment lassen wir uns immer wieder begeistern und inspirieren vom Zusammenspiel der Farben und Formen . Bettwäsche stellt wohl den sinnlichsten Teil der	Bettausstattung	dar und bringt Lebendigkeit in das Dunkel der Nacht . Gefühle werden angesprochen und bestimmen zum großen Teil die Faktoren , die zum Erwerb einer Garnitur für viele erholsame Nächte führen .	Sg	Ind	Bett	en	0
http://www.uni-leipzig.de/~kuge/zoellner/botticelli-fruehling.htm	0150cb2fbd9d2ae2bbbb646b34d027ef40c4	34	Botticellis Gemälde " Mars und Venus " dürfte aber ursprünglich als bildlicher Schmuck innerhalb einer hölzernen Wandverkleidung , einer sogenannten " spalliera " , gedient haben , einer damals sehr populären Bildgattung , die ebenfalls häufig im Zusammenhang von Hochzeiten bestellt wurde . Denkbar wäre auch die Anbringung im Rahmen einer hölzernen	Bettbekrönung	als " lettuccio " - Bild oberhalb des Bettes . Einen Eindruck vom Aussehen dieser Bildgattungen vermittelt Domenico Ghirlandaios Fresko mit der " Geburt Mariens " in S. Maria Novella in Florenz , wo die umlaufende Holzvertäfelung prächtige Einlegearbeiten und die Darstellung darüber tanzende " putti " aufweist .	Sg	Ind	Bett	en	0
http://www.djh-hessen.de/jugendherbergen/biedenkopf/?5e3696db6a045790ada10586e9013279=phYM54ftAcJRbEQteVW0t3	10fd56fbc31d8612a2df2d46165366bd20db	24	Hier muss man kein Technikfreak sein , um mit Spaß zu lernen ! Hier können Sie das PDF ( 3,2 MB ) " Robocamp " herunterladen » Zimmer , Unterbringung und Verpflegung Die Unterkunft verfügt für die Übernachtungen über 204 Betten in 37 Zimmern , je nach Anforderung für die 1 - , 2 - , 3 - , 6 - und 8 -	Bettbelegung	. Zahlreiche Zimmer sind besonders für die Übernachtungen von Familien mit Kindern geeignet ( Kinderbetten und - stühle sind vorhanden ) .	Sg	Ind	Bett	en	0
http://www.nabu-zoeschingen.de/Vogel/1992_Rotkehlchen.htm	956ae6e1bde33e6b703705216f044966f4e9	72	Ein weiteres dieser Tiere bekam zu Brutzwecken ein Menschenbett zugestanden . Während der	Bettbesitzer	beim Frühstück war , hatte es darin mit dem Nestbau begonnen . Als der Eigentümer zurückkam , sah er sich vor vollendeten Tatsachen und schlief bis zum Ausfliegen der Jungen woanders .	Sg	Ind	Bett	en	0
http://www.myfanfiction.de/texte/zac-efron/a-click-to-happiness.162845.448698.html	1c9588a35c1f5e615097450f51f2ece03e83	169	Nach ein paar Wochen kann noch keiner von Liebe reden . Ash du weißt doch was ich meine , du hast das doch schon öfter durch , so ne reine	Bettbeziehung	, mehr nicht . " , Vanessa rieb sich übers Gesicht , " Laßt mich einfach in Ruhe und wehe ... wehe " , sie drohte den beiden mit dem Zeigefinger , " Hayden , wehe du erzählst Joseph irgendwas .	Sg	Ind	Bett	en	0
http://fewo4rent.de/fewo/holiday.html	0a14ee6f6a8dd9d4d813eeed1d213f5e0047	22	Vor Ort sind zu zahlen : Stromverbrauch 0,20 Euro / kw-h sowie eine Kaution von 175 Euro , die bei Schluesselrueckgabe zurueckerstattet wird abzgl. Stromverbrauch . Mitzubringen sind :	Bettbezuege	( alle Betten 90 x 190 cm ) , Hand - u. Kuechentuecher . Bei vorheriger Reservierung Kinderstuhl / Kinderbett 22 Euro , Bettbezuege 13 Euro / Person , falls diese nicht mitgebracht werden .	Pl	Ind	Bett	en	0
http://www.kjk-muenchen.de/archiv/index.php?id=637%26abc=T	354fb6c62b5608bb68d1a305aa795a3552f3	8	Mickis Eltern präsentieren ihren Wohlstand lässig unterkühlt - frei nach dem Motto : Über Geld spricht man nicht , das hat man . Sie zeigen vornehme Lebensart vom gestylten	Bettbezug	des Sohnes bis hin zur silbergrauen Seidenbluse der Mutter , passend zu ihrem Haar und zum Fell des Pudels . Der Alltag von Ollis Eltern hingegen ist von Geldproblemen bestimmt .	Sg	Ind	Bett	en	0
http://www.harz.ferienwohnung-online.de/pahl/index.html	9e5914074bb196106cc89fe31446c0920629	6	Für Kurzurlaub Reise geeignet . Ferienwohnung , 80 qm , im 1. Stock im Stadtzentrum in ruhiger , zentraler Lage Zimmer für 2 Personen 25 EUR Zimmer für 4 Personen 35 EUR Kinder bis 5 Jahre kostenlos Günstige Pauschalangebote z. B. Wein-Wander-Wochenende ) Bettwäsche , Kopfkissen ,	Bettbezüge	, Handtücher , Strom - und Wasserverbrauch , Endreinigung im Preis enthalten . Kinderfreundliches Haus Haustiere erlaubt . Ausstattung der Ferienwohnung gemütlich , behaglich eingerichtet , 2 Schlafzimmer mit jeweils 2 Betten Kinderbett vorhanden Wohnzimmer , Esszimmer Alle Zimmer mit Teppichboden und Zentralheizung Moderne , neu renovierte Zimmer Fernsehanschluß mit TV-Gerät und Radio Moderne Einbauküche mit Spüle , inkl. Essgeschirr Waschmaschine gegen Gebühr Wäschetrockner gegen Gebühr Hof , Garten mit Gartenmöbel , Liegewiese mit 2 Liegen Einkaufsmöglichkeiten , Restaurants , Cafés Diverse Speiserestaurants in Vienenburg 5 Min . zu laufen Lebensmittelgeschäft , Metzgerei und Bäckerei in Vienenburg 5 Min zu laufen Parken , Fahrräder Kostenloser , hauseigener Parkplatz .	Pl	Ind	Bett	en	0
http://www.leitfaden-gesundheit.de/allergien/hausstauballergie/hausstauballergie-bei-kindern.html	cd1b3b0d4db1c376ff49f9ee32b74cfa9cea	23	Sehr empfehlenswert ist auch das Bett der Kinder an die Allergie anzupassen . Daher sollte vermehrt zu	Bettbezügen	aus Synthetikstoffen gegriffen werden anstatt zur Baumwolle . Dies sollte ebenfalls bei der Kinderkleidung beachtet werden .	Pl	Ind	Bett	en	0
http://www.bookmaps.de/lib/ruc/s/s/ssq.html	69d3d9582d21d883c6bce993a4b20246e92f	5	Süss , aber gefährlich : d. Zucker-Report Yudkin , John 2. Aufl. , 6. - 10. Tsd .. Hopferau Bioverlag Gesundleben . ¬ ) ¬ 1982 ¬ ( ¬ 343 S. . Gesundheits-Ratgeber ; Bd. 2. ISBN 3 - 922434 -04 - 5 SS . Salvator , ein gnadenreicher	Bettbrunnen	zu Bettbrunn : das ist Herkommen und Aufnemmen der alten Walfahrt zu Bettbrunn bey Ingostatt , insonders aber große wunderliche Gnaden und Gutthatten so der H. Salvator Jesus Christus als ein wahrer Lebens-Brunnen innerhalb 37 Jahr seinen Walfahrteren ... erwisen Schnaderbeck , Ambrosius ) Ingolstatt ( . ) Graß ( 1687. ) 23 ( , 323 S. : Ill ..	Sg	Ind	Bett	en	0
http://www.nichtraucher-unterkunft.de/detail/3827.html	7d5dab4241bd137b027e88d483b0a00c2095	8	Geboten wird ein Wohnzimmer mit Küche ( Geschirrspüler , Waschmaschine ) und ein Schlafzimmer mit Doppelbett ( 160 mal 200 cm ) . Zusätzlich	Bettcouch	im Schlafbereich oder Bettsofa im Wohnzimmer . Kinderreisebett . m Dachgeschoss zwei Einzelbetten mit jeweils 190 x 80 cm .	Sg	Ind	Bett	en	0
http://www.dooyoo.de/kinder-jugendbuecher/sing-mit-schlaf-gut/1106842/kinder-jugendbuecher/sing-mit-schlaf-gut/1106842	6ca83b35a023ef8a5a5a4ddc3f0b4231101e	47	und einer kleinen Spielanleitung zum Mondrennen was ich auch sehr schön finde ) * Hört ihr Herrn und lasst Euch sagen ... ( hier gibt es für die kleinen eine kleine Erklärung zum Lied ) * Müde bin ich , geh zur Ruh ( hier gibt es wieder eine schöne Spielidee , denn es gibt viele Kinder die vor dem Schlafen gehen nur langsam zur Ruhe kommen ) * Guten Abend , gute Nacht * Nun ruhen alle Wälder * Schlaf , mein Prinzchen , schlaf ein und * Schlaf , Kindlein , schlaf Die 4 letzten Lieder sind ohne Spiel oder Bastelideen . Als Nächstes folgt die Hauptgruppe " Schlaf gut " und diese beginnt mit einer süßen Illustration von schlafenden Tieren , dem Nachthimmel , dem Mond , und einem kleinen Kind , welches noch einen Nuckel hat , in der Hand hält es sein Kissen , sein	Bettdeck	und einen Teddy , dieses Bild erinnert mich ein wenig an unseren Jüngsten , allerdings braucht dieser keinen Nuckel mehr . Nun kommt erst einmal ein Wort an die Eltern , hier wird alles zum Thema Schlaf erläutert .	Sg	Ind	Bett	en	0
http://www.textem.de/index.php?id=2035	8d2dce01756da595d596afe91d72ebd00615	220	Besonders in der Suite mit hohen Balken und abgesenkter Sitzecke , die wir beziehen . Ich liege auf einer rauen	Bettdecke	und meine zu spüren , wie sich die Gehirnwellen , angeregt durch solche Erinnerungsmuster , in Urlaubsstimmung bringen . Sie haben mir da was voraus .	Sg	Ind	Bett	en	0
http://www.dolc.de/archiver/?tid-1361581.html	5acff5306dbdaad80a08e9c7ecae132368e3	1	Pauschalreisen mit guten Hotels sind in der Regel bei rechtzeitiger Buchung recht günstig zu bekommen . Geschrieben von : Johanna Kategorien : Allgemein Hinterlasse einen Kommentar Kategorien Allgemein Asien Deutschland Europa USA Archiv Wähle den Monat Dezember 2011 ( 1 ) November 2011 ( 33 ) Oktober 2011 ( 32 ) September 2011 ( 29 ) August 2011 ( 16 ) Juli 2011 ( 9 ) Juni 2011 ( 8 ) Mai 2011 ( 8 ) April 2011 ( 7 ) März 2011 ( 13 ) Februar 2011 ( 4 ) Januar 2011 ( 3 ) Dezember 2010 ( 7 ) November 2010 ( 1 ) Oktober 2010 ( 9 ) September 2010 ( 6 ) August 2010 ( 5 ) Juli 2010 ( 1 ) April 2010 ( 3 ) März 2010 ( 1 ) Januar 2010 ( 1 ) November 2009 ( 1 ) September 2009 ( 1 ) August 2009 ( 1 ) Juli 2009 ( 1 ) April 2009 ( 1 ) Februar 2009 ( 2 ) Dezember 2008 ( 1 ) Oktober 2008 ( 1 ) September 2008 ( 1 ) August 2008 ( 2 ) Juli 2008 ( 2 ) Juni 2008 ( 1 ) Suche Copyright 2010 : news-reisewelt.de | Alle Rechte vorbehalten 萍聚社区 's Archiver 论坛 › 环保与能源 › 请问旧被子枕头 , 还有一带过期大米 , 算什么垃圾 , 谢谢 PQbear 发表于 2011 - 7 -25 09:19:5 5 请问旧被子枕头 , 还有一带过期大米 , 算什么垃圾 , 谢谢 rt permanent 19 发表于 2011 - 7 -25 11:44:4 4 旧的被子枕头得专门放在衣服垃圾的那个箱子里面 过期大米算bio垃圾 PQbear 发表于 2011 - 7 -25 12:09:5 4 谢谢 yuanlaiyuanqu 发表于 2011 - 7 -25 12:30:3 5 旧的被子枕头得专门放在衣服垃圾的那个箱子里面 过期大米算bio垃圾 { : 5 _ 327 :} yxcv 发表于 2011 - 7 -25 12:37:3 4 那个不叫衣服垃圾箱吧 ， 是指捐赠衣服的箱子吗 得完好的而且要洗干净的衣物什么的才能放进去 ffl 2004 发表于 2011 - 7 -25 13:24:1 0 yxcv 发表于 2011 - 7 -25 13:37 static / image / common / b ack.gif 那个不叫衣服垃圾箱吧 ， 是指捐赠衣服的箱子吗 得完好的而且要洗干净的衣物什么的才能放进去 谢谢普及知识拉 { : 5 _ 310 :} sigmund 001 发表于 2011 - 7 -25 14:53:1 8 大米没长虫 ， 都还是可以吃的 。 。 。 PQbear 发表于 2011 - 7 -25 17:34:4 0	Bettdecken	und Kissen können mit verschiedenen Materialien wie Federn , Schafwolle , Latex oder Roßhaar gefüllt sein . Falls Bettdecken oder Kopfkissen noch brauchbar sind , bei Hilfsorganisationen s. unten ) anfragen , ob Bedarf besteht . Keine Annahme bei Johannitern und Caritas !	Pl	Ind	Bett	en	0
http://www.einrichtungsforum.de/chofah-thailaendische-skultur-t611.html	0aaaedd14b2396588eacdcd1837b5e41cc88	1	Aktuelle Reiseangebote zu Top-Preisen finden Sie hier . reise-report.de / Aktuelle News / Reise-News Reisetipps Schleswig-Holstein Sonne & Meer Familienreisen Sport & Aktiv Wellnessreisen Kulturreisen Städtereisen Abenteuerreisen Kreuzfahrten Camping Reiseplanung Brückentage 2011 Urlaubscheckliste Fremdenverkehr Die beste Reisezeit Gesundheit Gut geplant Notrufnummern Auto & Urlaub Suche Zum Inhalt Einrichtung ‹ Internationale Wohnkultur Ändere Schriftgröße Druckansicht FAQ Chofah - Thailändische Skultur 1 Beitrag • Seite 1 von 1 " International Interiors • Wo gibt es dieses japanische	Bettdesign	? » von pyro-ghost » So Jun 17 , 2007 7:19 pm Hallo , an alle !	Sg	Ind	Bett	en	0
http://web2.cylex.de/suche/oesterreich/ort-/plz-/l1cy1-a_ort1cy1--plz1cy1-_name1cy1-allergien-s1.html	fa5607cf3fff1548fa12db57c37564ab2742	5	Dafür sprechen der Bekanntheitsgrad von 40 P. .. Exclusive Collection , Bettenprogramm , Zubehör , Kindermatratzen , Sembella , Matratzen , Rahmen , Lattenrahmen , Betteinleger ,	Betteinsätze	, Lattenroste , ... GASTEINER HEILSTOLLEN A-5645 BÖCKSTEIN , HEILSTOLLENSTRAßE 19 DER GASTEINER HEILSTOLLEN IST AUFGRUND SEINER HOHEN ERFOLGSQUOTEN DAS WIRKUNGSVOLLSTE KURMITTEL IM GASTEINERTAL . DIE KUR IST BEIHILFEFÄHIG UND WIRD VON DEN M. ..	Pl	Ind	Bett	en	0
http://www.max-der-erfinder.de	78acd8f8d9463a972b15fd9ad697ea8d7a00	247	Ihr Baby soll ja schließlich sicher und gut gebettet auf die Reise gehen können . Solche Babytragetaschen sind doch oft der wichtigste	Bettersatz	in den allerersten Lebenswochen . Wenn sie gut ausgekleidet ist , und am besten noch mit einem Tuch , das den Geruch der Mutter trägt , und das Baby wird sich sichtlich wohl fühlen und beruhigt schlummern .	Sg	Ind	Bett	en	0
http://www.produktlinks3.homepage.t-online.de/Daunen.html	651763041e9068122a678bdf19d152a461eb	5	Bettfedernreinigung - Erwin Müller : Die Reinigung für Ihre Betten ... Die Reinigung für Ihre Betten , Kissen und andere Daunen - / Feder-Produkte Bettfedernreinigung Bettfedernreinigung Bettfedernreinigung ,	Bettfedern	, Dampfreinigung , Bett , Federn , Feder , Dampf , Daunen ... Daunendecken , Steppbetten , Cassettenbetten , Kopfkissen mit Daunen ...	Pl	Ind	Bett	en	0
http://www.worms.de/deutsch/kultur/wussten_sies/Nachkriegserinnerungen.php	6e342cca33a16f3d1b5cfaf88274c6b1a0c8	73	Im Sommer wuschen sich die Knechte im Hof am Brunnen und im Winter im Pferdestall . Als	Bettflasche	wurde ein großer Feldstein in den Backofen gelegt , abends in ein Tuch gewickelt und ins Bett gelegt . Ich aber , ich hatte ein ganz besonderes Privileg , denn ich bekam einen Steinkrug .	Sg	Ind	Bett	en	0
http://www.schweizerfamilie.ch/kreativ/artikel/warme-geschenke.html	d756b81c85e26c114995cdd40b501b6d7a2c	30	Kanten absteppen , Arbeit wenden . Seelenwärmer Bettflasche Chic in Strick und in Pelz präsentieren sich die	Bettflaschen	. Die Hüllen kann man aus Kunstpelz nähen oder mit Wolle stricken .	Pl	Ind	Bett	en	0
http://forum.runnersworld.de/forum/foren-archiv/22115-firmen-staffellauf-oder-die-berge-auf-der-rechten-rheinseite.html	decb0b7ca1fb459c9ed979027bc5bb507656	16	Aber Vernunft gepaart mit Laufen hat bei mir noch nie so wirklich gut funktioniert . Erlebnis-Halbmarathon : 4.30 Uhr - in einem erneuten Anfall von seniler	Bettflucht	schmeiß ich mich aus den Federn an den Rechner . Es ist kein Regen angesagt - prima .	Sg	Ind	Bett	en	0
http://www.matratzen-lummer.de/unsere-produkte-wasserbetten-wasserbett-paderborn-matratzen-lummer-delbrueck.htm	45e29b23572d3bb163088b815e8fb9257e8c	2	Haben Sie schon einmal das unvergleichliche Gefühl getestet , auf einem Wasserbett zu liegen bzw. zu schlafen ? Ob klassische	Bettform	, rund , achteckig , modern oder exclusiv - ein Wasserbett ist immer etwas Besonderes . Matratzen Lummer in Delbrück , Ihr Fachgeschäft für Matratzen , Wasserbetten , Schlafzimmer , Polsterbetten und sämtliches gesundes Schlafzubehör in allerbester Qualität im Raum Delbrück , Gütersloh , Paderborn ist Ihr Fachhändler für Wasserbetten der Firma Reckert ( r-w-m ) .	Sg	Ind	Bett	en	0
http://www.decido.de/suche-schlafsofa+mit+bettkasten.html	3618e994c03b9cc748471bd63099d6091156	11	In 2 erstklassigen Bezugsqualitäten erhältlich , alle pflegeleicht und strapazierfähig . Artikeldetails : Frei im Raum stellbar : Frei im Raum stellbar , Bettfunktion : mit	Bettfunktion	, Bettkasten : mit Bettkasten , Art und ... Details zu Schlafsofa , uni BAUR Versand Händlerinfo Shopbewertung ) 3 / 0 / 1 ( zzgl. Versandkosten : 25,90 € , Lieferzeit : 14 Tage , Preis kann jetzt höher sein !	Sg	Ind	Bett	en	0
http://www.frauenworte.de/vbforum/archive/index.php/t-8623.html	e2bf1ce50d41dad9cf39d590585124721c41	292	Und wenn Biggi , erzählt , dann ist das Kind doch immer mitten drin . So das waren nun meine	Bettgedanken	... vielleicht liege ich auch total falsch ... wollte es aber einfach mal mitteilen . Liebe Grüße Leonie --- Kerstin S ( 2666 Beiträge ) 21 - 03 -2005 , 08:21 Uhr ( GMT ) 20. " Gedankenübertragung :-))) " Ihr zwei Süssen , genau oder so ähnlich denke ich auch .	Pl	Ind	Bett	en	0
http://www.asthma.msd.de/asthma_und_allergie/4500_tipps_bei_allergien_print.html	e3c4e572810c904db59221b10e86d4eb02bb	23	Bei Asthmapatienten kann eine solche Allergie die Asthmabeschwerden verschlimmern und sogar einen Asthmaanfall auslösen . Hausstaubmilben gibt es in jedem Haushalt , sie sind sozusagen unsere unsichtbaren	Bettgefährten	. Die meisten Milben leben in der Matratze , bis zu 10 Millionen können sich darin tummeln und sich vor allem von Hautschuppen ernähren .	Pl	Ind	Bett	en	0
http://www.koppert.de/blog/category/koppert-newsletter/page/11	c22a9c9dac6e2bf703c2f48f907e49852c5d	334	Die haben sich ausnahmslos geoutet als publikumsgeile Selbstdarsteller der Bonsaiklasse . Echte Qualitäts-Journalisten hätten dem alten Paar zumindest das eine oder andere	Bettgeheimnis	der vergangenen Legislatur-Periode entlockt . Oder gar das Geständnis , dass man die vergangenen vier Jahre zusammen nur " Koalitionsgeschützten Verkehr " praktizierte .	Sg	Ind	Bett	en	0
http://dichterschwanke.di.funpic.de/liedschri.htm	aaa805b01aaeac13c0f90a10529c299c7c9c	160	Sophia habe ich geliebt Von meiner frühsten Jugend an , Ich liebte ihre Schönheit sehr , Begehrte sie zu meiner Braut ! Beschlossen habe ich bei mir , Zu freien sie zu meiner Braut , Zur Weggefährtin , Ehefrau , Zur	Bettgenossin	in dem Geist ! Ratgeberin zum Guten sie Und Trösterin in Traurigkeit !	Sg	Ind	Bett	en	0
http://www.tatort-fundus.de/web/rangliste/folgen-wertungen/rangliste-auswertung/einzelwertungen-einer-tatort-folge.html?Nr=9%26folge=817.0	d978c474710247bc3693b95369df4fda9711	259	Viel Rauch um Nichts , absurder Plot . Im Mittelpunkt steht letztendlich die	Bettgeschichte	zwischen Kunzendorf und Führmann . noti 7.5 claudia 5.5 HiWolf 7.5 dizzywhiz 8.0 Zagosip 8.5 Das Ende war nur mit ausgeprägter Kombinationsgabe zu verstehen .	Sg	Ind	Bett	en	0
http://www.elitepartner.ch/forum/the-rules-bin-total-verwirrt-wie-sehen-das-die-maenner-hier-49935.html	1872a8693533f51b4d4fc54537b5a948bcf3	134	Mit Spielchen und gekünstelt hat das nicht im geringsten zu tun . Wenn du natürlich nur eine	Bettgeschichten	suchst , brauchst du dich nicht dran halten . Hallo , aus meiner Sicht schützt Du Dich vor Kontakten mit unaufdringlichen Männern , die es nicht nötig haben , den Beginn einer Beziehung als Eroberungsspielchen zu betrachten .	Pl	Ind	Bett	en	0
http://www.schlafen-aktuell.de/forum/fragen-zur-wassermenge/t-lieg-ich-mit-meiner-wasservermutung-richtig-4580.html	004eedcef0ef5e05d6cff5132bb3f87b325b	29	Da ich erst im letzten Monat umgezogen bin , lag das Bett etwa 2 Wochen gut aufgehoben im Büro . ( Die Matratze sah aus wie ein ausgesaugter Luftballon ) Ich habe das	Bettgestell	aufgebaut und anschließend die Matratzen gefüllt . Ich habe Momentan den Vorteil , dass ich das Bett alleine Nutzen kann .	Sg	Ind	Bett	en	0
http://www.abfallwirtschaft-ortenaukreis.de/abfaelle-von-a-zett/accordion-a-zett/m	3e048a129bb509916f2cf6c8848d252dd5f1	2	Die Abfälle von A-Zett als PDF zum Ausdrucken finden Sie hier . Matratze Entsorgung : Matratzen , Kopfkissen , Betten ,	Bettgestelle	und Bettroste können zur Sperrmüllabfuhr bereitgestellt oder gebührenfrei auf Deponien , die Sperrmüll annehmen , abgegeben werden . Medikament Entsorgung siehe Altmedikamente Medizinisches Gerät Medizinische Geräte z.B. elektronische Blutdruckmessgeräte ) aus dem Haushalt können auf Deponien die Elektro - / Elektronikschrott annehmen , oder bei der Problemstoffsammlung , gebührenfrei abgegeben werden . Problemstoffsammeltermine Für die Entsorgung von elektrischen Geräten aus z.B. Arztpraxen an die Abfallberatung Tel. 0781 805 - 9600 ; emailblank ) wenden . Metallschrott Metallschrott wie Wäscheständer , Fahrräder , Kinderwägen usw. können zur Sperrmüllabfuhr bereitgestellt oder gebührenfrei auf Deponien , die Metallschrott annehmen , abgegeben werden .	Pl	Ind	Bett	en	0
http://www.shogazi.de/blog	1b1e0ebf2b3d164c825fb517062bf7e1f962	47	Massivholzbetten sind dagegen solide , massiv und erscheinen unverwüstlich . Dabei ist bei diesen	Bettgestellen	ebenso Filigranes zu entdecken wie bei Futons . Bei Massivholzbetten ist das Holz entscheidend .	Pl	Ind	Bett	en	0
http://www.mgepa.nrw.de/ministerium/presse/pressemitteilungsarchiv/pm2012/pm20120503a/index.php	33ba2513033732c04a8fc740ab9051cdf401	13	Das Motto der ReduFix-Kampagne " Eure Sorge fesselt mich " bringe zum Ausdruck , worum es geht : Anders sehen und anders handeln , wenn es um Fragen der Sorge insbesondere von Menschen mit Demenz geht . " In England sind	Bettgitter	, Fixiergurte und andere freiheitsentziehende Maßnahmen in der Pflege so gut wie unbekannt " , fügte Klie hinzu . " Auf dem Weg zum fixierungsfreien Heim wollen wir die Pflegeeinrichtungen fachlich unterstützen " , kündigte Ministerin Steffens auf der Tagung an .	Pl	Ind	Bett	en	0
http://www.pflege.de/blog/?p=944	02c05af89f8d6d78d1cbbee63817036d2fa2	21	Hier erfahren Sie mehr dazu . Freitag Das Anbringen von	Bettgittern	und Fixierungen von demenzkranken Bewohnern von Pflegeeinrichtungen am Stuhl mit Beckengurten sind freiheitsentziehende Maßnahmen im Sinne des § 1906 Abs. 4 des Bürgerlichen Gesetzbuches ( BGB ) , wenn der Betroffene möglicherweise noch willentlich seine Bewegungen steuern kann . Allerdings wird sein Selbstbestimmungsrecht nicht dadurch beeinträchtigt , dass die Einwilligung seines Betreuers ( " Bevollmächtigten " ) zur freiheitsentziehenden Maßnahme gerichtlich genehmigt werden muss .	Pl	Ind	Bett	en	0
http://web.ard.de/themenwoche_2012/01.html	b5e6432e6a2c7686c17ad1205a6e42f6ab7f	41	Einige Dinge müssen sie extra benennen , damit die bevollmächtigte Person auch darüber entscheiden darf . Das betrifft bestimmte schwerwiegende Maßnahmen oder Eingriffe wie freiheitsentziehende Maßnahmen ( etwa das Anbringen eines	Bettgitters	oder auch die Gabe von starken Beruhigungsmitteln ) . Auch wenn die bevollmächtigte Person sich selbst Geld aus Ihrem Vermögen überweisen können soll , muss das konkret in der Vollmacht benannt sein .	Sg	Ind	Bett	en	0
http://www.schlafen-aktuell.de/forum/fragen-zu-herstellern-marken-haendlern/t-erfahrungen-mit-abbco-oder-florida-nights-637.html	45a90d83cd0b2c84cf58fdd01f8026cbbc51	35	Softsider ist sowieso verhältnismässig leichter als der Hardsider . Erläuterung : " Schwergewicht " > 100 kg braucht einigen Raum für Wasserverdrängung , das muss man bei der	Bettgröße	und notfalls auch der Matratzenhöhe berücksichtigen . Bin selber 187 cm groß und über 100 kg schwer - da ist das 200x220 das absolute Minimum ...	Sg	Ind	Bett	en	0
http://www.doctorsdiaryfanforum.de/t1416f192-Story-von-Julie-1.html	d1b07103d8b80ca321b46651b2b6c95eff18	165	" Ach weißt du was , ich hab mich heute schon genug geärgert , lass uns darüber nicht streiten . Jeder schläft in seiner	Betthälfte	und gut , okay ... " " Okay , wollen wir noch etwas trinken gehen oder willst du ins Bett ?	Sg	Ind	Bett	en	0
