DocURL	DocID	SentID	LC	Match	RC	N2Num	N2Typ	N1Lemma	N1Pl	LE
http://www.uelzener.de/singlefamilien-versicherungen/news-detail-ansicht/artikel/schulprobleme-durch-sehschwaeche.html	22c3f267dbde8be25e0b7e3170ab05854f1c	19	Finden Sie einfach und schnell Ihren Ansprechpartner vor Ort ! Presse Anbieter / Impressum Kontakt HundeHaftpflicht	Katzenversicherung	Reiterversicherung Pferdeversicherung Pferd & Reiter Versicherung Sterbegeldversicherung Landwirtschaft-Versicherung . Schokolade-Maikäfer mit Minze-Trüffel-Füllung Autor : Rene Datum : 16.05.1994 Kategorie : Kuchen , Gebäck , Pralinen Zutaten : 250 g Dunkle Bitterschokolade 60 g Helle Schokolade 200 g Dunkle Schokolade ; gehackt 50 g Doppelrahm 35 g Kristallzucker 3 El .	Sg	Ind	Katze	n	1
http://www.aqua-terra-net.de/Reise/reise4a.htm	9f962a23f33b335d1afb618a3fa7eb20013a	16	Das Verbreitungsgebiet von S. bainsii ist hingegen sehr klein und umfaßt lediglich kleine Habitate im Kowie , Great Fish , Keiskamma , Buffalo und Nahoon River . Durch die Verschleppung von in Südafrika als	Katzenwelse	bezeichnete Clarias gariepinus ( nicht zu verwechseln mit den aus Nordamerika bei uns eingebürgerten Ictalurus nebulosus ) in diese Flüsse wurden die ohnehin schon kleinen Bestände erheblich dezimiert . Ein weitere Gefahr droht nun den Restbeständen durch die Massenvermehrung des südamerikanischen Schwimmfarns Azolla filiculoides , der sicherlich nicht zu Unrecht als Pest bezeichnet wird .	Pl	Ind	Katze	n	1
http://www.kater-tommy.de/gedenkseite/katze_kelly/kelly.htm	5955f9b78e235d6c6cf06c97330e92791def	20	Neben mir auf deinen liebsten Platz den du hattest im Leben liebe Kelly nie werden wir dich aus unseren Herzen geben . Liebe Kelly , du warst unsere Glückskatze , die schönste und liebste Katze von der ganzen	Katzenwelt	. Nun bist du deinen Weg über die Regenbogenbrücke gegangen .	Sg	Ind	Katze	n	1
http://www.von-silver-sikala.de/sibirische-katzen.html	69896702f9a2bb71c66c046d67fa1742dfd9	4	Auf diesen Seiten findet Ihr viele Informationen über die Sibirische Katze und Neva Masquarade . Zudem ein Katzen Lexikon , Infos zu der Punktvergabe auf Katzen Ausstellungen und auch einige witzige Dinge wie	Katzenwitze	, Katzenfilme , Katzen Gifs und Katzenbilder . Etwas lustig ist auch die Doku mit unseren Katzen , als wir die neuen Kratzbäume und die Kratzburg aufgestellt haben .	Pl	Ind	Katze	n	1
http://www.rehlings-world.de/anna.htm	a1ed56d559d16e0413aad68d0f212a4c517a	24	" Wie bei der Vermittlung abgesprochen , brachte Sie mir Anna wieder zurück . Sie machte ihre Runde im	Katzenzimmer	und von da an wich sie nicht mehr von meiner Seite . Sie schlief auf meiner Brust ein und bewachte mich ununterbrochen .	Sg	Ind	Katze	n	1
http://www.geliebte-katze.de/information/katzenhaltung/katzenkauf-neukoemmling/katze-vom-zuechter.html	ed66bb9267b26fb7da794e065d821b4468e0	18	Sind Tierheimkatzen zu teuer ? Die Katze aus zweiter Hand Studie : Katzenwahl nach Persönlichkeit Mieze sucht aus , Mensch macht mit Eine verschmuste Katzenbande Erste Schritte im neuen Zuhause Bindung zur Katze aufbauen Erstausstattung für Jungkatzen Europäischer Heimtierausweis für Katzen Katzen-Stammbaum Ein Rassekätzchen erwirbt man beim seriösen	Katzenzüchter	. Wie erkenne ich einen solchen ?	Sg	Ind	Katze	n	1
http://www.gartenforum2008.de/f78t3272-herbstastern-vermehren.html	97fa528a8cd6a33954f2b6f4645dd06f5782	56	Was auch noch zur Bestimmung helfen könnte ( ich denke , dass es sich bei dieser Höhe und dem angegbenen Farbton " rot " eher um eine Raublattaster handelt ) : die Blüte sieht ziemlich zerwuschelt aus , ich schau mal , ob ein Foto von meiner Raublatt finde , die ist zwar lila - es geht aber ja um die Blüte !! Und die Blätter fühlen sich , wenn du gegen den Strich darüber fährst , rau an - fast wie eine	Katzenzunge	- denn sie weisen winzig kleine Haare auf . LG drei hühner Du hast keine ausreichende Berechtigung , um die Dateianhänge dieses Beitrags anzusehen .	Sg	Ind	Katze	n	1
http://www.katzen-links.de/katzenforum2/archive/index.php/t-3207.html	4cb98b0e23e6a797a40c24bd346054cc6103	69	Liebe Alberta , das ist eine sehr traurige Geschichte , die du da erleben musstest ! Und nun hat dein Sammy Pankreainsuffiziens , und darf keinem Stress ausgesetzt werden , könnte aber dennoch mit einem Katzenkumpel sehr glücklich werden bzw. ein Alleinsein kann ja auch mal Stress bedeuten , z.B. wenn du mal in den Urlaub fährst oder länger außer Haus bist ) . Das blöde ist , eine	Katzenzusammenführung	bedeutet natürlich Stress für eine Katze , und man kann noch nicht mal im Vorraus sagen , ob das neue Tier dann akzeptiert oder lediglich geduldet wird . Im letzteren Fall wäre das Risiko von Stress ja immer wieder gegeben , da Revieransprüche immer wieder neu ausgefochten werden müssen .	Sg	Coll	Katze	n	1
