DocURL	DocID	SentID	LC	Match	RC	N2Num	N2Typ	N1Lemma	N1Pl	LE
http://www.antbo.de/kataloge/a0299/seite-1.html	39760eea4d40d7b7c08cd8c5201c7cae6d82	528	Texte und Aussprüche . ] [ Belletristik - Literatur ] ) Details ( Bachstein , Julia ( Auswahl und Zusammenstellung ) ) : Der literarische	Katzenkalender	2008. Frankfurt a.M. Schöffling & Co . Verlagsbuchhandlung 2007. Wochenkalender mit schwarz / weiss-Fotos und literarischen Texten in schwarz / rot-Druck .	Sg	Ind	Katze	n	1
http://birma-somali.de/Informatives.html	483b890406e1f2be51f7e7d0661be1996af2	2	Diese Seite wird ständig erweitert . Toxoplasmose Herzerkrankungen Blutgruppen bei Katzen Pyruvatkinase-Mangel Somaligeschichte Birmalegende	Katzenkauf	Blutgruppen bei Katzen Seit 1915 sind verschiedene Blutgruppen bei Katzen in der Literatur erwähnt , erst durch wissenschaftliche Arbeiten im Jahr 1981 wurden die Blutgruppentypen A , B sowie die seltenere Blutgruppe AB bekannt . Vererbung Die Vererbung wird in einem einfachen autosomal dominanten Erbgang mit zwei Allelen auf dem selben Genort vererbt .	Sg	Ind	Katze	n	1
http://www.webbstar.de/tag/hals	43104ccb31c7776d86d47039c3b96a31d633	33	Schlagwörter : Bauer Media , BRAVO , Die Welt , Dj , Foto , Hals , Hamburg , Ins , Katrin , Ke$has Erpresser exklusiv in BRAVO : " Ke $ ha ist besessen von mir ! " , Media Group , Mir , Mit , Musiker , Nacktfoto , Packt , Pop , Quelle , Trap House , Zitate 29 07 2010 Kitty goes wild : Pinkes Kätzchen tobt sich in die Herzen von Notebook-Besitzern Teutschenthal - Wer jüngst bei einem Besuch im Tierheim nicht an dem süßen	Katzenkind	vorbeigehen konnte , kennt vielleicht diesen Anblick : Die Wohnzimmertapete hängt in schlaffen Fetzen von der Wand , der Lieblingssessel ist so zerkratzt , dass die Federn fliegen und auf der Fußmatte wartet als Willkommensgeschenk eine ungestüm erlegte , kleine Maus . Den Rest des Eintrages lesen » Schlagwörter : Arbeit , Cm 15 , Die Maus , Gar Nichts , Hals , Kitty , Kitty goes wild : Pinkes Kätzchen tobt sich in die Herzen von Notebook-Besitzern , Manga , Mit , Notebook , Notebooks , Notebooktaschen , Sortiment , trend , Ums , Uni , Von Hinten , Wand 20 07 2010 Die neue congstar Kampagne bringt " Andy on Tour " Kölner Telekommunikationsdiscounter schreibt Andy-Erfolgsgeschichte fort Köln , 19. Juli 2010. Heute startet mit " Andy on Tour " die Fortsetzung der congstar Erfolgskampagne " Andy will wechseln " .	Sg	Ind	Katze	n	1
http://www.rehlings-world.de/einganznormalermorgen.htm	fccc312666bbbf0d82836a8e62ee1abeaeb8	36	Radio an , Buch auf den Schoß und erst mal genießen , das es noch so früh ist , alle noch schlafen und ich nicht in ein oder zwei Stunden aufstehen muss . Nach kurzer Zeit schleicht ein Kater , ein zweiter Kater und eine schüchterne Mieze durch die	Katzenklappe	in mein Gemach und hechten mit einem eleganten Satz auf meine Bettdecke . Einmal auf dem Platz eine Drehung , dann das Näschen an den eigenen Hintern gelegt und kurze Zeit später höre ich leises Geschnarche , weil zwei schon wieder pennen .	Sg	Ind	Katze	n	1
http://hx3.de/hilfe-54/router-welche-empfehlenswert-9842	0d7be05114978f5d24c592632f1ca0619e61	29	Da mir niemand gescheite Tips geben konnte ... ( selbst im näheren Freundeskreis wurden die Router wohl nur nach dem Preis gewertet ) ... bin ich nun ins Geschäft reingegangen und hab ein	Katzenklo	... äh ... ein Router gekauft .	Sg	Ind	Katze	n	1
http://www.kitticat.de/archive/index.php/t-8738.html	783a73e5b1a2a4a870b7a819a925f49f2219	59	Wir haben Sammy dann sehr oft ins Katzenklo gesetzt ( immer wenn wir meinten er müßte mal ) und nach 2 - 3 Wochen später hat er dann nur noch ins Katzenklo gemacht . Heute habe ich nur noch 3	Katzenklos	verteilt stehen . LG Schokosternchen Powered by vBulletin® Version 4.1.7 Copyright © 2011 Adduco Digital e.K. und vBulletin Solutions , Inc . Alle Rechte vorbehalten .	Pl	Ind	Katze	n	1
http://www.logo-design.de/corporate-design-logo/neues-logo--ci	5d6bafe924401bf0acb99454c7aae9150afd	77	@Ralf L. 50498 : auch gut - aber siehe unten zu den Assoziationen aufgebrochener Kugeln . @creative design : 50678 und 50682 gefallen mir beide - siehe zu den Kugel-Assoziationen unten @vertigo : das Grüne Gebilde ist interessant - erinnert aber entweder an einen	Katzenkopf	oder die Anfänge der Computerspiele . Zu den Farben - siehe oben .	Sg	Ind	Katze	n	1
http://www.katzen-links.de/katzenforum2/archive/index.php/t-3207.html	4cb98b0e23e6a797a40c24bd346054cc6103	285	Anders ist das bei dem Rescue . Auch vorsorglich gibts du ja vorher einen Tropfen auf beide	Katzenköpfe	. Dann hatte ich ja vorgeschlagen , das Rescue an den Reaktionen der Katzen orientiert weiterzugeben , also je aufgebrachter , aufgeregter , erschreckter die Katzen sind , desto kürzer die Abstände der einzelnen Gaben an diesem Tag .	Pl	Ind	Katze	n	1
http://www.kaninchenforum.de/kaninchenhaltung-allgemeines/15252-kruemel-darf-nicht-mehr-raus.html	c43e4eea0c095a2fc99f5d5cab34c4c6d243	14	Ich merke jetzt schon , wie Krümel die lange Weile plagt . Ich hab ihr 2 unterschiedlich lange Rascheltunnel , einen Snackball und einen	Katzenkorb	um sie abzulenken , das hebt auch kurze Zeit , aber nicht lange . Wie kann ich Krümel in der Wohnung besser beschäftigen und ablenken ?	Sg	Ind	Katze	n	1
http://www.katzen-links.de/katzenforum2/archive/index.php/t-10157.html	8b37b30038e12faa4699f36a931af4323a17	9	Am Freitag hat sie mir schon wieder ins Bett gemacht . Auch ins	Katzenkörbchen	. Und sie reißt meine frisch gewaschene Wäsche vom Wäscheständer und macht da auch drauf .	Sg	Ind	Katze	n	1
http://www.tierarzt-onlineverzeichnis.de/blog/so-bleibt-ihre-katze-gesund	611df1fe2338ea58a6c63b3c6c22615d76cd	15	Die Parasitenkontrolle wird ebenfalls durch den Tierarzt vorgenommen . Dazu gehören z. B. auch Wurmkuren , die je nach Anbieter ebenfalls von der	Katzenkrankenversicherung	übernommen werden . Wie können Sie den Gesundheitszustand Ihrer Katze überprüfen ?	Sg	Ind	Katze	n	1
http://www.katzen-links.de/katzenforum2/archive/index.php/t-43932.html	74c7cd99918921de4a48e1d3b4f3d5a2f1f1	3	Seht euch Janosch an !!! Klingelton für Katzenliebhaber Weitere Foren : Hundeforum Katzenforum Pferdeforum Tags : Kätzchen , Suche Rassehunde Rassekatzen Pferdemarkt Großpferde & Ponys Welpen Chihuahua Tierheim Hunde Berlin Tag Cloud Gruppen Katzenforum von Netz-Katzen.de >	Katzenkrankheiten	> Herzerkrankungen > Mal wieder Moustache ... Hilfe ! PDA Archiv verlassen und diese Seite im Standarddesign anzeigen : Mal wieder Moustache ... Hilfe ! Tierfreundin 23.08.2005 , 17:12 Hallo Ihr Lieben , irgendwie reist meine Pechsträhne nicht ab .	Pl	Ind	Katze	n	1
http://www.katzenschutz-lanzarote.de/vermittlung2.htm	ea36e45da4e1e5da9c8f1f0382309aa89047	16	Ein jetzt schon sehr großer Kater mit wunderschönen Augen , sehr lieb und verschmust . In seinem neuen Zuhause , in reiner Wohnungshaltung , sollte ein etwa gleichaltriger	Katzenkumpel	vorhanden sein . schüchterne Corredises sucht Haushalt mit Artgenossen geb.ca. 8 / 08 , getupft , eine noch sehr schüchterne Katze die aber in einem ruhigen Zuhause und mit Geduld ihrer Menschen auf dem besten Weg ist ganz zahm zu werden .	Sg	Ind	Katze	n	1
http://www.misstilly.de/artikel/das-fruehlings-tillyskop.html	42cf0a3b7b208aa8dc827b1ee0da5a336dc0	3	Sechs seiner Leben hat er schon in den Trümmern des eingestürzten Kölner Stadtarchivs gelassen . Die Sternzeichen seiner bisherigen	Katzenleben	konnten noch nicht ermittelt werden . Die Kuh - 21. April - 20. Mai Von wegen : Milch von glücklichen Kühen !	Pl	Ind	Katze	n	1
http://www.frettchen-community.de/archive/2501/thread.html	f3c7a05219cb3b553350346362044532c85a	20	Ich dachte immer das ist nicht so gut . welches ? die ham nämlich mehrere ( also bei uns ) muffin Wir haben immer die Hundeleckerchen gefüttert , weil da im Gegensatz zu den	Katzenleckerchen	kein Zucker drin war . Jetzt haben sie dabei nicht nur die Verpackung sondern auch die Zusammensetzung geändert !	Pl	Ind	Katze	n	1
http://www.tierschutzverein-hessisch-lichtenau.de/geschichten.htm	e2bc8787015ca563bc1739de87804dc26d99	16	Aber das war sie nicht , und nun musste doch etwas unternommen werden . Großes Glück für Isis war , das es hier in Hirschhagen die Firma Haarbusch gibt und dort ein sehr netter Mann arbeitet der auch noch ein	Katzenliebhaber	ist . Und Thorsten zog sich seine Steigeisen an und lief den Baum hinauf wie wir " normalen " Leute eine Treppe !	Sg	Ind	Katze	n	1
http://www.yungaya.de/thai-siam/fotos2.htm	3f91f42d7a8729c457afdf884a4caf3c2950	4	Der R - Wurf ( Mutter Int.Ch.Tab ea 's Bellissima , Vater Int.Ch.Cal imero v.Dah lienring ) mit dem diese Galerieseite startet , war im Jahr 2001 . Gr. E uro.Ch.Yun gaya 's Rashira ist ein	Katzenmädchen	der Farbe blue-point . Sie ist mit 8 Monaten Jugenchampion , mit einem Jahr Internationaler Champion und war bereits 3 x Best in Show !	Sg	Ind	Katze	n	1
http://www.kitticat.de/archive/index.php/t-8041.html	39dcb58f05c16e90fba527b7944169e2edbd	4	Ich hab ja zum ersten Mal Babys , die Kleinen sind jetzt 4 Wochen alt . Ich hab nu schon oft gehört das die	Katzenmama	nicht unbedingt ziemperlich mit ihren Jungen umgeht aber das gerade hat mir doch einen gehörigen Schrecken eingejagt . Die Mama fing an das Kleine zu putzen , dabei wurde sie immer heftiger und das Baby fing an sich zu wehren und schrie .	Sg	Ind	Katze	n	1
http://www.kurzbemerkt.de/kommentare/katzentag-katzenmanifest-montagsstarter....440	c7dd9abb44a322afa7f932c2e987f8af33f8	17	Miau an alle Blogger ! Wir haben den Katzentag zum Anlass genommen , unser eigenes	Katzenmanifest	zu erpfoteln und hoffen sehr , dass unsere Dosine und auch alle anderen Dosenöffner das beherzigen und uns nicht in der Ausführung hindern ! Am besten , Ihr Menschen hängt es Euch irgendwo hin , wo Ihr es IMMER sehen könnt !	Sg	Ind	Katze	n	1
http://www.dashaustierforum.de/katzen-allgemeines/warum-katze-t30792.html	b5781758d6f1fe415ad8cc0485fa39264742	243	Gehe ich ins Wohnzimmer , rappeln sich die Ratten hoch und kommen an das Türchen , die eine will Leckerchen und die andere Aufmerksamkeit , und die Renner sind derzeit wieder im Freßwahn und sobald ich am Terra langgehe , machen sie Männchen in 3 erReihe .. 40 Pfoten also zur Begrüßung .. :whistling: Ich denke bei dieser " Hunde-und oder	Katzenmensch	" - Geschichte geht es ja darum , das Hunden und Katzen eigentlich ziemlich unterschiedlich sind vom Grund her . Es gibt auch immernoch genügend Menschen die glauben Hunde und Katzen in einem Haushalt und erst recht Wohnung würde nicht funktionieren deswegen .	Sg	Ind	Katze	n	1
http://www.web-angebot.de/Tierwelt/katze-katzen-katzenbabys.html	484868c52db439ac7bb5b8ae42abc37ac798	18	Längst nicht immer kann jede Katze mit einer anderen friedlich zusammenleben . Kommt es zum Stress , dann versuchen sich die	Katzenmenschen	in Selbsthilfe : Sie wenden sich zuerst an andere Katzenhalter , häufig in Internetforen . Auch stark gefragt ist der Einsatz von Bachblüten .	Pl	Ind	Katze	n	1
http://www.von-silver-sikala.de/katzen-abc/katzen-lexikon-a-ammenaufzucht.html	9b4298a98c6302957bd8b97de572854684e8	8	Diese sollte möglichst auch erst vor kurzem geworfen haben . Der neuen	Katzenmutter	dürfen jedoch zu ihren eigenen Welpen nur so viele verwaiste Jungtiere gegeben werden , wie sie Zitzen hat und dementsprechend säugen kann . Es ist aber nicht anzuraten , die verwaisten Kätzchen einfach zu den leiblichen Kindern der künftigen Katzenamme zu legen .	Sg	Ind	Katze	n	1
http://www.shortstories.de/vb/archive/index.php?t-2880.html	21625fc2dc6926954a249489369d9498f21d	117	Hmm , " Grüne Katzen " von Lakita , " Fette Kotzekatze 007 vs . Santa Claus " von Rattengöttin , "	Katzennarr	" von Franzl , " Kater Paul " von LuScha und im Dialogforum " Bürokater " von lakita und " Rrrr ... " von Roswitha ... das Thema " Katzen " scheint derzeit ein ganz heißes zu sein .	Sg	Ind	Katze	n	1
http://www.happypainting.de/archive/index.php/t-11899.html	b0113c5a26bc93f336763b6b3e973ee69782	44	Aber , auch wenn ich mal wieder die Einzige bin , gefällt mir die Nase nicht gut .	Katzennasen	enden seitlich unter den Augen nicht so abrupt . Vielleicht hast du ja Lust , die Übergänge noch weicher zu gestalten ?	Pl	Ind	Katze	n	1
http://forum.zooplus.de/search.php?s=0cb84159f4666018e17eca6828d400ec%26searchid=1121185	9f077578fa354409b087eb9895858574a572	22	Uih , das ist ja toll ! Danke dir , Moni - und vielen Dank an alle , die fürs	Katzennetzwerk	abstimmen . :bl: :bl: :bl: :) Kleiner Hinweis noch - es kann anscheinend ab und zu passieren , dass man die ...	Sg	Coll	Katze	n	1
http://www.fledermausschutz-rlp.de/News20040701.htm	fcd3ac9baff98630bd6f9d62147b7ee6a026	22	Ihre Körpertemperatur haben sie abgesenkt , sie wirken lethargisch . Gleiches gilt im Übrigen auch für	Katzenopfer	und durch den Winter ausgezehrte Tiere im Frühjahr . Tollwut , besteht nun Grund zur Sorge ?	Pl	Ind	Katze	n	1
http://www.kitticat.de/30466-fotos-aus-dem-katzengarten-seite3.html	38572693043dc8883c09fc6728ac38bd4995	14	Die Etagen-Hängematte gefällt mir auch gut , sieht toll aus . 22.06.2013 12:17 # 79 Das ist ein Katzenparadies , und auch ich finde die Hängematte toll LG Uschi 22.06.2013 13:35 # 80 Savannah Katzenmeister Vorname Brunhilde Dabei seit 20.11.2008 Beiträge 4,291 Ort Düsseldorf Katzen 4 Katzenrassen 3 Hauskater , 1 Perser - Mix Ein wunderschönes	Katzenparadies	! 22.06.2013 16:59 # 81 Ganz toll hast du das wieder hin bekommen Christine , die Hängematte find ich auch Klasse 23.06.2013 09:18 # 82 Midnight Kitticat-Fan Dabei seit 31.03.2010 Beiträge 2,062 Ort Duisburg Katzen 4 Katzenrassen 2 EKH 's , EKHMix und Türkisch Van Mix Wieder gaaaanz tolle Bilder sehr schön 23.06.2013 10:33 # 83 ich dank euch lg Christine 23.06.2013 11:05 # 84 super Bilder Christine , wie immer .	Sg	Ind	Katze	n	1
http://www.blankenheim-info.de/a-z/ortschaften/alendorf.htm	9a78380430fed7a8f7fb944864feb08741a9	50	Regelmäßige Beweidung macht es möglich , dass sich Pflanzen , die auf Trockenrasen gedeihen , auf den Triften entfalten . Zu diesen Pflanzen gehören Kuhschelle , Kugelblume , Deutscher Enzian , Gewimperter Enzian , Zwergeichengamander , Geflecktes Ferkelkraut , Blaugras , Stengellose Distel , Bergklee , Hügelmeister , Schafschwingel , Meergrüne Segge ,	Katzenpfötchen	, Sonnenröschen , Fliegenblume , Bergkölme und Lein . Wo wenig oder keine Beweidung stattfindet , entwickelten sich Gebüsch und sogar hochstämmige Bäume wie Stieleiche , Rotbuche und Hainbuche .	Pl	Ind	Katze	n	1
http://www.knx-professionals.de/forum/archive/index.php/t-1383.html	9501a957c8d1b19479258f5c8c13cc1cdcd5	8	Hallo , gib der Katze doch einfach ein Transponder Halsband , dann kann auch nur deine Katze rein ! :D Gruß MArtin Matthias Schmidt 31. January 2004 , 19:20 Hab auch schon von Katzenklappen mit Gesichtserkennung gelesen , die auch unterscheiden können zwischen eigene Katze - fremde Katze sowie mit / ohne Vogel / Maus im Maul :D Dundi 31. January 2004 , 20:35 Christian < --- > *Brüll* Wie wäre es denn mit Implantaten in den	Katzenpfoten	? : D Die Magnetschleife unter der Fußmatte erkennt dann die Katze anhand eines Kurzschlusses .	Pl	Ind	Katze	n	1
http://www.kitticat.de/22160-wer-verkauft-auf-ratenzahlung.html	7ba22b69ee5f6d16af1015fe56581548d979	22	Hunde-Welpen kosten je nach Rasse zwischen 1.500 Euro und 3.000 Euro . Wie die	Katzenpreise	sind , weiß ich natürlich nicht . Vereinbarungen können getroffen werden , aber kontrollieren oder durchsetzen kann es ein Züchter wohl eher nicht .	Pl	Ind	Katze	n	1
http://www.nachtwelten.de/vB/history/topic/61520-1.html	e5ef3aed9c264fa611f3b86b85ae71d984d2	186	Aber nunja , man lebt so vor sich hin , hat Geld , Freunde , Hobbies , genügend Interessen ... was will ich eigentlich mehr ? geschrieben von :	Katzenschatten	Das Gefühl leben zu können , frei zu sein ; das fehlt meistens und scheint auch irgendwie nicht mehr so wichtig sein , weil man hat ja das im vorherigen Beitrag genannte ... Ausserdem ist es meist schwer einen " vernünftigen " Schnitt zu machen , wenn noch jemand anderes mit dran hängt geschrieben von : wookie Zitat : Original geschrieben von Katzenschatten Das Gefühl leben zu können , frei zu sein ; das fehlt meistens und scheint auch irgendwie nicht mehr so wichtig sein , weil man hat ja das im vorherigen Beitrag genannte ...	Pl	Ind	Katze	n	1
http://www.katzen-links.de/katzenforum2/archive/index.php/t-4939.html	d0176aa9bf81c1dc50e9e63bcde182dc950c	64	Als es dann so weit war , morgens , 8.45 h und Zeit , meine Tochter in den Kindergarten zu bringen , gab es gar keine Frage mehr , was denn wohl mit unserer Katze los wäre : sie miaute so auf die " aua , das tat weh " - Art und lief dann schnurstraks - nein , nicht zur Wurfkiste , sondern in den Trockner . :wink: ein kleines	Katzenschwänzchen	war auch schon zu sehen und es war klar , dass sie nicht daran dachte , den Trockner zu verlassen . Ich hab 's ihr dann mit Handtüchern im Trockner gemütlich gemacht .	Sg	Ind	Katze	n	1
http://blog.meinekatzeundich.de/tag/katze/page/6	9bc30b2c8519d6e908f026d8f4f9fc2b4dc2	183	Der Katzenschwanz dient der Katze einerseits dazu im Sprung und im Fall die Balance zu halten und andererseits ist der Katzenschwanz ein Indikator für die unterschiedlichen Stimmungen der Katze aus . Die Stellung und Bewegung des	Katzenschwanzes	zeigen relativ deutlich in welcher Stimmung die Katze gerade ist . Wedelt die Katze mit dem Schwanz bedeutet es nicht - wie bei einem Hund - , dass sie sich freut , sondern die Katze befindet sich eindeutig in einer Art Konflikt .	Sg	Ind	Katze	n	1
http://www.katzen-links.de/katzenforum2/archive/index.php/t-10511.html	d814d33af90e633a87b0b313d1a9740b4257	32	Vielleicht hilft folgendes : einfach nicht beachten und in einen anderen Raum gehen , sich dort niederlassen , dasselbe , wenn sie dort auch auf den Tisch springt - sie einfach mit Mißachtung strafen , wenn sie auf den Tisch springt . Das ganze natürlich mit zig Wiederholungen , bis es klappt , Vorwarnung : der Geduldsfaden einer Katze ist um ca. 300 Kilometer länger , als der des Menschen :wink: Vielleicht betrachtet sie das " Nein " , die Wasserspritze und so weiter aber auch als so eine Art Spiel , das sie mit Euch nur spielen kann , wenn sie auf den Tisch springt ... es gibt	Katzenseelen	die sind unergründlich ... Oder es geht ums Essen - hat sie schon vom Tisch-Essen mal was abbekommen - oder mal unbeobachtet was stibitzt , was ihr schmeckte ?	Pl	Ind	Katze	n	1
http://www.cats-world.de/address3.htm	0c5e00fc9e754e0ffa46becd8dadfa2b3195	3	Trotzdem sind es schon eine ganze Menge geworden , und so hab ich eine nette Liste zusammengestellt - natürlich mit der unentbehrlichen Hilfe von Miller & Miss Sophie !! Die Katzenwunderwelt - CatChat , Katzen-Webcams , Steckbriefe , Schnappschüsse , Service rund um die Katz ' , free Downloads uvm. Schmusekatzen - Molly & ihre 16 Freunde stellen sich vor - eine Seite mit viel Spaß und Informationen PhantasieWelten - keine reine	Katzenseite	, aber lesenswerte OnlineLiteratur : Katzenkrimi , Fantasygeschichten , Märchen ... Odins Gedenkseite - die anrührende Geschichte eines Katers , der sich in die Herzen einer " Im-Grunde-nur-Hunde-Familie " schlich Der Tierfreund - Ratgeberseiten : Naturheilkunde , Tierschutzge - setz , Tierärzte , Verhaltenstherapeuten , Kliniken , Aktuelles ...	Sg	Ind	Katze	n	1
http://www.dashaustierforum.de/katzen-allgemeines/allgemeine-frage-zum-thema-katzenhaltung-t35755.html	9fe076dc623d919c664e10edf35c3517588b	318	Eure Kleidung wird öfter mal kleine Löcher und Wollsachen gezogene Fäden aufweisen - könntet ihr damit leben ? Wenn der Kratzbaum an einem - aus	Katzensicht	- doofen Ort steht , werden die Katzen das Ding meiden und sich eben in den Regalen breit machen . Auch wenn sie den ein oder anderen Gegenstand dabei auf den Boden schmeißen müssen um bequem zu liegen ...	Sg	Ind	Katze	n	1
http://www.katzen-links.de/katzenforum2/archive/index.php/t-81279.html	d72dce03327ec6b65ec8ccaa418aeae02bb6	75	Hallo , weiß gar nicht , ob das hier so reinpasst , aber ich hab ' mich vorhin mit einer Kollegin über Katzen unterhalten , sie fragte mich wie es meinem Kater so geht .. Und dann erzählte sie von einem befreundeten Ehepaar , dessen Katze jetzt zum 25. 8O Geburtstag ein neues	Katzensofa	geschenkt bekommen hat . Ich hab nochmal nachgefragt , es war wirklich die Katze , die 25 geworden ist .	Sg	Ind	Katze	n	1
http://haustierisch.de/katzentunnel-fur-den-stubentiger.html	3f724980357deef1d5a68e86e7d131d8dcce	24	Ein paar Kugeln aus fest zusammengepresster Alufolie oder mehrere Holzkugeln an einem Faden an den Eingang gehängt , sind tolle Spielzeuge für wenig Geld . Aber auch gekauftes	Katzenspielzeug	kommt gut an . Eine Plastikmaus oder eine Kugel , in der sich innen ein Glöckchen befindet , machen besonders jungen Katzen großen Spaß .	Sg	Ind	Katze	n	1
http://www.alemannia-brett.de/forums/archive/index.php/t-6995.html	72d26473d621723ec8f59691579318aef68b	23	Ich glaub , er meinte Speldorf ... das ist ein Teil von Mülheim a.d.R. und nur nen Katzensprung von Duisburg weg ... Fussballjunkie 26.06.2009 , 19:06 Ich glaub , er meinte Speldorf ... das ist ein Teil von Mülheim a.d.R. und nur nen	Katzensprung	von Duisburg weg ... sicherlich nicht , passt ja bei oberhausen auch nicht . seit wie vielen jahren , ist es eigentlich jetzt schon das der " amateur-topf " heimrecht hat in runde 1 ?	Sg	Ind	Katze	n	1
http://www.dillum.ch/html/teufelsburdi_jolimont_gals.htm	d292e2d65bdc4533b72c734599c1ecf71ad7	81	Doch gerade bei der Teufelsburdi auf dem Jolimont und bei anderen Findlingen kommen wir durch eingehende Überlegungen etwas weiter . Der bereits mehrfach zitierte Berner Heimatkunde-Forscher Karl Ludwig Schmalz aus Bolligen erörtert in seinem Bolligen-Führer von 1985 den Weg von ein paar rund um den Bantiger abgelagerten Findlingen aus den Alpen vgl. die Abbildung ) . Der Weg zweier Findlinge zum Bantiger A : Eklogit-Block vom Allalinhorn im Wallis über den " Rhonegletscher " nach Harnischhut bei Geristein , nördlich des Bantigers B : Findlinge von verschiedenen Gesteinsarten aus dem oberen Haslital , vom " Aaregletscher " auf 850 Meter über Meer auf dem	Katzensteig	südlich des Bantiger-Gipfels abgelagert . aus : Karl Ludwig Schmalz : Heimatkundlicher Führer Bolligen ; Bern 1985 , S. 26 Drei Dinge sind es , die stutzig machen , wenn man sich die Dinge genau überlegt .	Sg	Ind	Katze	n	1
http://www.50plus-treff.de/forum/was-lest-ihr-gerade--t25166-s30.html	d1a989bff1580ecd010973d58b98cd7488b6	68	Aber einem Buch von M. Adolf kann ich nicht wiederstehen . Liebe Grüße	Katzenstern	. Zurück zu Freundschaft & Familie Impressum | AGB | Datenschutz | Hilfe und Kontakt | Kostenlos anmelden | Partner | Partnerprogramm | Presse | Werbung | Archiv | Magazin | Blog | Jobs © 2005 - 2011 50 plus-Treff GmbH Home Autorenportal Liebe Liebesgeschichten Liebestests Liebesgedichte Deine Geschichte Heirat & Ehe Schwangerschaft Homosexualität Musik Halbgöttliche Versuchung Autor : roses of mackintosh veröffentlicht am : 07.11.2008 ' Ja bitte ?	Sg	Ind	Katze	n	1
http://suche.deine-tierwelt.de/foren/Rassekatzen.html	269aa38201f4df0fd901e9046fd968854748	70	Ich habe viele Sorten durch - ohne Erfolg . Trockenfutter und so	Katzensticks	sind kein Problem . Wer kann mir helfen .	Pl	Ind	Katze	n	1
http://forum.gaming-universe.de/lofiversion/index.php/t6263-600.html	49ad57015972d69c066653834dc7d3b91f10	96	Tut mir leid Sieht total lieb aus auf dem Bild . Zum Thema "	Katzenthread	" ... wie wäre es denn mit einer Umfrage : " Was für ein Haustier habt ihr ? " 14. Dec 2010 , 16:41 Hab hier ganz viele Staubhasen .	Sg	Ind	Katze	n	1
http://www.die-reiseseite.de/fr_nico_dosi.htm	501547c5888107464b96240b672424108a04	2	Nico , habe ich ähnlich wie Bonny und Benny über eine Internetseite entdeckt . Eigentlich war es nicht unbedingt geplant noch ein drittes	Katzentier	zu holen . Was mich aber nicht daran hinderte , immer wieder auf Katzenseiten zu schnüffeln .	Sg	Ind	Katze	n	1
http://www.rehlings-world.de/einkatzenkindziehtein.htm	6b4bf1e153196fb4ca8471e68a3002ec4495	35	Auch sollten sie nicht gleich die ganze Wohnung unsicher machen . Setze den Neuankömmling erst mal in seine	Katzentoilette	und dann lass ihn allein erst mal 1 - 2 Zimmer seines neuen Revier erkunden . Du wirst sehen , dass es sich schnell zurechtfinden wird und sich sicher fühlt .	Sg	Ind	Katze	n	1
http://www.katzen-links.de/katzenforum2/archive/index.php/t-43663.html	9f1b61fb90aee5089a890e216bbe8c6a9340	546	Toi toi toi , dass alles gut wird und sie sich weiterhin so gut erholt !!! 20.12.2005 , 08:18 Servus Sylvia :-) nach (m)einem anstrengenden Wochenende ( Adventpunsch beim	Katzentreffen	in Wien ;-) ) habe ich gleich nachgelesen , wie es Mäuschen so geht . Bin wirklich froh , dass sich deine Kleine so gut erholt hat - und das Fell wächst ja bestimmt wieder nach .	Sg	Coll	Katze	n	1
http://www.tierrechts-foren.de/archive/index.php/thread-2664.html	95e432e5a5acfeb89833a6f79df1a61aad15	81	Und das gemeinsam oft mit Ihnen , mit Protesten und in Abstimmung untereinander . Das waren Zeiten , als wir die Staatsjagd gekippt haben , die	Katzenverbrennungen	Jugendlicher verfolgten und allen Tierquälern die Fetzen um die Ohren flogen ! Das Nottelefon im Verbund mit fast 50 Vereinen und Ihre wertvolle Arbeit in diesem Netzwerk !	Pl	Ind	Katze	n	1
http://www.katzen-links.de/katzenforum2/archive/index.php/t-1393.html	df886cb78608857bdd0bae236a5b2803bbb6	61	Es wird von ' hauptsache gesund ' geredet - woher wisst Ihr dass ? Leider gibt es naemlich nicht nur Infektionskrankheiten , gegen die ein verantwortungsvoller Zuechter impfen laesst ( und auch impfen lassen muss , weil der	Katzenverein	dies vorschreibt ) , sondern auch Erbkrankheiten . Hiervor die Augen zu verschliessen ( wie so viele es leider tun ) ist dumm und befordert die Zucht von Rassekatzen nicht .	Sg	Coll	Katze	n	1
