DocURL	DocID	SentID	LC	Match	RC	N2Num	N2Typ	N1Lemma	N1Pl	LE
http://www.clavio.de/forum/werke-komponisten-musiker/9499-lieblingsstuecke-von-robert-schumann-und-franz-liszt.html	e9a200eaea7e5ee53df2766d9577ff64fe19	10	mich würde mal interssieren was eure Lieblngsstücke von Schumann und / oder Liszt sind . hallo , erst mal ein " Hybrid " oder " Klon " : Schumann / Liszt : Widmung (	Liedtranskription	) - absolut wunderwoll !!! meine Lieblingsstücke : a) Schumann Klavierkonzert a-Moll komplett ( für mich das schönste Klavierkonzert überhaupt ) Kinderszenen komplett ( ein epochales Meisterwerk ! ) Klavierquintett Es-Dur ( vor allem der langsame Satz ) Mondnacht ( Lied für Mezzo & Klavier ) Er , der herrlichste von allen ( Lied , aus dem Chamisso-Zyklus ) Waldesgespräch ( Lied , nach Eichendorff ) Widmung ( Lied , nach Rückert ) Frühlingssinfonie komplett rheinische Sinfonie komplett Papillons komplett ( charmant und romantisch ) Nachklänge aus dem Theater ( aus dem Album für die Jugend , 2 Teil ) " die Bässe durchaus leicht und frei " ( aus Kreisleriana ) b) Liszt Sonate Les Preludes Dante-Sinfonie Via Crucis Mephisto-Walzer A-Dur Paganini-Etüden Es-Dur & gis-Moll La legierrezza ( Konzertetüde ) Gnomenreigen ( Konzertetüde ) Tannhäuser Ouvertüre ( Transkription ) Abendstern ( Transkription ) Isoldens Liebestod ( Transkription ) Rigoletto-Paraphrase Miserere di Trovatore Paraphrase la lugubre Gondola Czadras macabre danza sacra e finale ( Aida ) Paraphrase summ und brumm ( Spinnstubenszene , Holländer ) Paraphrase Consolation III Einzug der Götter in Walhall ( Transkription ) Orage ( Annees de Pelerinage ) Les Funerailles am Grabe Richard Wagners Ständchen Transkription ( eher Paraphrase ) Soiree de Vienne Nr. 6 Klavierkonzert A-Dur Fantasie und Fuge über b-a-c-h Tarantella ( annees de pelerinage - italie ) Canzonette di Salvatore Rossi ( annes de pelerinage - italie ) feux follets ( Transzendental-Etüde ) Norma-Reminiszenzen Wasserspiele der Villa d ' Este fantastische Sinfonie ( Berlioz ) Transkription " ein Ball " , " Gang zum Richtplatz " und " Traum von einem Hexensabbat " ( also 2. , 4. & 5. Satz ) heilige Elisabeth ( Oratorium ) komplett soweit meine privaten Favoriten von Schumann und Liszt Gruß , Rolf Digg 28.01.2010 09:48 # 4 sla 019 Erfahrener Benutzer setzt Akzente Registriert seit 19.10.2009 Ort tief in Bayern Beiträge 1.276 hi , mich würde mal interssieren was eure Lieblngsstücke von Schumann sind .	Sg	Ind	Lied	er	0
http://www.urmel-dl.de/Projekte/BibliothecaElectoralis/HistorischerAbriss/Inhalt.html	8a86b26a250f8ace84ae6ac518edc7382bba	9	Während letztere dem Gründungs­bestand der " Bibliotheca electoralis " selbst angehören , ist ein großer Teil der mittelalterlichen Handschriften klösterlicher Provenienz und kam als Säkularisationsgut hinzu . Ein kulturelles Monument eigener Klasse ist die ebenfalls zur " Bibliotheca electoralis " zählende Jenaer Liederhandschrift ( Signatur : ThULB , Ms El . f. 101 ) , die neben der Großen Heidelberger Liederhandschrift ( Manesse-Codex ) bedeutendste , größte und prachtvollste Handschrift mit deutscher	Liedüberlieferung	des Mittelalters , ohne die uns zahlreiche Autoren und Texte des Hochmittelalters unbekannt geblieben wären . GAC-Forum > Reviews > ASGs > Review Double Eagle M 81 ( USP ) AEP PDA Archiv verlassen und diese Seite im Standarddesign anzeigen : Review Double Eagle M 81 ( USP ) AEP Provokateur 23.05.2007 , 19:03 Review Double Eagle M 81 ( USP ) AEP uriblank Gliederung 1 ) Hintergrund und Kaufintention 2 ) Bestellung und Ablauf 3 ) Erhalt der ASG 4 ) Lieferumfang und Begutachtung der Teile 5 ) Batteriewechsel 6 ) Bedienung und Einstellen des Hop-Up 7 ) Gewicht , Maße , ROF und Präzision im Vergleich mit KJW P 8 8) Tuning 9 ) Abschließende Worte und Fazit 1 ) Hintergrund und Kaufintention Mir war zu Augen gekommen , dass verschiedene Importeure ( noch vor Marui , welche auch eine USP AEP angekündigt haben ) in Deutschland die Double Eagle M 81 , eine USP-AEP auf den Markt gebracht hatten . Dieses Produkt weckte meine Neugier .	Sg	Ind	Lied	er	0
http://www.sibel-nefa.de//magazin/bauchtanz-magazine-inhalt.htm	0f99f1bf2abbfb938ef6ff51c30011a4785e	137	• Arabische Musik versthen : Teil XI - Riq . •	Liedübersetzung	: Mashi Haddih . • Diverse Orient Nachrichten • Orient Leser-Forum • Diverse Showberichte • Spieglein , Spieglein an der Wand ...	Sg	Ind	Lied	er	0
http://verkauf.donkiz.de/verkauf/zither_ddr.htm	4378f6d960d1a7a9ac14225b1072f9afb8d6	6	Beschreibung wegen anstehendem Umzug müssen wir uns von einigen Dingen trennen ... DDR Kinderzither in der Orginalverpackung ... 1	Liedvorlage	ist noch ... 09 - 10 -2011 - ebay.de Speichern Kinder-Zither VEB Musikinstrumente " MUSIMA " Markneukirchen / DDR in Berlin - Treptow | Musikinstrumente | eBay Kleinanzeigen Beschreibung Biete hier eine Kinder-Zither von VEB Musikinstrumentebau " MUSIMA " Markneukirchen / DDR mit original Karton , Spielanleitung , ...	Sg	Ind	Lied	er	0
http://blog.orzydorf.de/category/pfarrer_topits/page/3	30839c6a3ff535a85d915e37f94d3c16e611	454	Meiner Meinung nach eignet sich für diesen Sonntag gut das " Hochgebet von der Versöhnung . "	Liedvorschläge	: 642,1 - 3 ; 831,1 ; 119,1 ; 530,1 ; 644 ; 834,1 ; 835,1 ; 917 ; Nach kurzer Stille 916 zum Dankgesang . Anschließend Auszug zum Kriegergedenken .	Pl	Ind	Lied	er	0
http://www.mittelpfalz.de/neidenfels/2009/mgv02/index.htm	eac540ed0727e2944783b808c37f999cb0d6	14	Mit ihrem Gequake hatten die Männer des MGV Frohsinn Lindenberg bei der " Hochzeit der Frösche " die Lacher auf ihrer Seite und krönten damit ihren Gesamtvortrag . Den schwierigsten Part hatten allerdings an diesem Abend die Sänger des Männerchor Neidenfels zu absolvieren : Den ersten	Liedvortrag	in englischer Sprache . Damit sie sich noch einmal " stärken " konnten , hatte Karl Wirtz ( Vorsitzender des Vereins ) die Überraschung des Abends vor diesen Auftritt gelegt .	Sg	Ind	Lied	er	0
http://www.gv-concordia.de/Berichte.htm	7bd25b69e4430a95303fbb9dded25429df55	221	Bei diesem Wettbewerb wurde nach einem neuen und noch nicht so bekannten Wertungssystem beurteilt . Es wurden hervorragende	Liedvorträge	zu Gehör gebracht , die durchweg vom hohen Standart der Sangeskunst zeugten . Der Wettbewerb war von der 1. Schriftführerin der Concordia Heike Leander hervorragend organisiert , die auch den ganzen Tag als Beisitzerin der Wertungsrichter fungierte .	Pl	Ind	Lied	er	0
http://www.leopoldshoehe.de/Themen/veranstaltungen-4	09cd369730713ef99a3212a7b1280e77b429	43	Kirche Leopoldshöhe Veranstalter : Ev .- ref . Kirchengemeinde Leopoldshöhe Am 3. Advent kommen noch einmal die Freunde des Chorgesangs auf ihre Kosten : die Leopoldshöher Chöre laden zum traditionellen Gemeinschaftskonzert in die evangelisch-reformierte Kirche in Leopoldshöhe ein und werden ihre Zuhörerinnen und Zuhörer mit ihren	Liedvorträgen	sicher wieder in weihnachtliche Stimmung versetzen . Besinnliche Weihnacht Kategorie : Feiertagsveranstaltungen Datum : 15.12.2011 , 16:00 Uhr Ort : Feuerwache Leopoldshöhe , Schuckenteichweg 1 Veranstalter : Freiwillige Feuerwehr Leopoldshöhe Weihnachstfeier des SoVD - OV Leopoldshöhe Kategorie : Sonstiges Datum : 16.12.2011 , 15:00 Uhr Ort : Gaststätte " Evenhauser Krug " , Evenhausen 31 Veranstalter : SoVD e. V. Ortsverband Leopoldshöhe 4. Advent Gottesdienst Kategorie : Kirchenveranstaltungen Datum : 18.12.2011 , 09:45 Uhr Ort : Ev .- ref .	Pl	Ind	Lied	er	0
http://www.alternobis.de/fdkalender/rezensionen/rez_890922_berlin.htm	ab8a3c868df3a5c7be3893fac1bdb56dfd75	8	Aber es scheint eben doch nicht so einfach , zwei einander künstlerisch ebenbürtige Solisten unter das gemeinsame leichte ( wenn interpretatorisch auch herzlich schwere ) Joch des Duettierens zu zwingen . Ein anderer Grund für die Seltenheit des gemeinsamen	Liedvortrags	im Duett liegt wohl auch daran , daß es an einem Repertoire mangelt , das für den Konzertvortrag taugt . Die meisten Duette waren nun einmal für den Eigengebrauch , den geselligen Vortrag in der Bürgerstube des Musizierens gedacht .	Sg	Ind	Lied	er	0
http://www.lettre.de/archiv/91-Wimmer.html	e0d0288665a6314f056b1c12ba10739f3371	12	Ein denkwürdiges Datum ist der 19. August 1927 , an dem zwei junge Komponisten in Mexiko-Stadt die Musikgeschichte revolutionierten . An diesem Tag fiebern die Gäste im piekfeinen Teatro Lírico in der Altstadt dem	Liedwettbewerb	La Feria de la Canción entgegen . In der Jury sitzen alte Hasen der Tonkunst und Anhänger einer Ästhetik , die sich seit dem vergangenen Jahrhundert kaum weiterentwickelt hat : Man liebt pastoralen Schwulst , kitschige Kunstlieder , Arien , Fandangos oder nationalistisches Trara .	Sg	Ind	Lied	er	0
http://www.sounds2move.de/Plattenkritiken/ohrenfeindt_rnr_sexgott.htm	afab5025df2dbe37fc86a385f719515f1c58	5	Chris Laut , seines Zeichens Sänger und Bassist der Hamburger Formation Ohrendfeindt , kommt stimmlich wirklich sehr nahe an Brian Johnson heran . Auch er presst seine Stimme sehr halslastig ins Mikro und so wird die eine oder andere	Liedzeile	auch einfach nur geschrieen . Ohrendfeindt sind Rock ' n Roll der harten Sorte , dreckig , ehrlich , laut , hier dominiert die Gitarre das musikalische Geschehen und so soll es auch sein , prasseln doch massig harte Riffs in die Ohren des geneigten Zuhörers , so dass die Drums leider hier und da einfach in den Hintergrund geraten .	Sg	Ind	Lied	er	0
http://www.ccmtexte.de/rezis/cds/h/ahutchison-christmas.htm	ec826fd1264265182f4656b6037a8b2eb0f2	15	Zudem seien sie abwechslungsreich und spannend fürs Publikum . Wer genau hinhört , erkennt , dass sich die ausgewählten	Liedzeilen	geschickt zu einer Geschichte zusammenfügen . In der Abfolge von " O Come , O Come , Emmanuel " , " Coventry Carol " und " What Child Is This ?	Pl	Ind	Lied	er	0
http://www.ks-gasteig.de/kuenstleragentur/kuenstler/kammermusik/home.htm	31e77f0bf33b6af6c7a93200353c2f834b6d	3	In erster Linie sind dies Auftritte der von uns exklusiv vertretenen Künstler , die neben ihren Engagements mit großen Orchestern auch im kleinen Kreis musizieren möchten . So vermitteln wir immer wieder Auftritte in den großen europäischen	Liedzentren	, zahlreichen Konzertorten sowie im Rahmen bedeutender Festivals . Wir freuen uns , Ihnen aktuell folgende Kammermusik-Projekte mit unseren Künstlern anbieten zu können : Festival-Tournee mit Julia Fischer ( Violine ) , Augustin Hadelich ( Violine ) Württembergisches Kammerorchester Heilbronn / Ruben Gazarian Termine : 19. und 27. Juli 2014 und weitere Termine nach Absprache Programmvorschlag : G. F. Händel : Concerto grosso J.S. Bach : Konzert für 2 Violinen und Streichorchester BWV 1043 Das Ensemble " Schubertvokal " mit Sibylla Rubens , Silke Schwarz ( Sopran ) Ingeborg Danz , Regina Jacobi ( Alt ) Markus Schäfer , Marcus Ullmann ( Tenor ) Markus Flaig , Klaus Häger ( Bariton ) Ulrich Eisenlohr ( Piano ) Sämtliche Mehrstimmige Schubert Gesänge mit Klavier Termine nach Absprache Juliane Banse ( Sopran ) , Martin Helmchen ( Klavier ) Termine nach Absprache Programm nach Absprache Claudio Bohórquez ( Violoncello ) und Katia Skanavi ( Klavier ) Termine nach Absprache Programmvorschlag : Ludwig van Beethoven : Sonata op 102 Nr. 1 Robert Schumann : 5 Stücke im Volkston op 102 Robert Schumann : Fantasiestücke op 73 ***Pause*** Robert Schumann : Adagio & Allegro op 70 Dmitri Schostakowitsch : Sonata ( 1934 ) Claudio Bohórquez ( Violoncello ) und Oscar Bohórquez ( Violine ) Termine nach Absprache Programmvorschlag Johann Sebastian Bach : Die Kunst der Fuge BWV 1080 für Violine und Violoncello Astor Piazzolla : Tango Etudes 1. - 6. für Violine und Violoncello ***Pause*** Zoltan Kodaly : Duo für Violine und Violoncello Op 7 Daishin Kashimoto ( Violine ) , Oskar Bohórquez ( Violine ) , Antoine Tamestit ( Viola ) , Claudio Bohórquez ( Violoncello ) und Kiril Gerstein ( Klavier ) Termine nach Absprache Programmvorschlag : J.S. Bach : Englische Suite Nr. 2 a-moll BWV 807 Dimitrij Schostakowitsch : Streichquartett Nr. 8 c-moll op .110 ***Pause*** Johannes Brahms : Klavierquintettt f-moll op .34 Stella Doufexis ( Mezzosopran ) und Urs Liska ( Klavier ) Termine nach Absprache Programmvorschlag : Arnold Schönberg : Zwei Lieder op 14 Anton Webern : Fünf Lieder op .	Pl	Ind	Lied	er	0
http://www.fussball-pur.de/forum/archive/3786/2/thread.html	e957f4830ecb0d81181f079fcbb3434cf4b6	61	Bei uns wurde es mit Megaphon versucht , aber die Leute wurden ausm Block geworfen . Da kann man j auch gleich	Liedzettel	verteilen . Gegen Bayern beispielsweise hatten wir keinen Einpeitscher = > absolut sensationelle Stimmung , gegen Ende kam der Einpeitscher doch auf den Zaun ( ohne Hilfsmittel wie Megaphon etc. ) = > die Stimmung wurde nochmal deutlich besser !	Pl	Ind	Lied	er	0
http://www.musenblaetter.de/artikel.php?aid=2558%26suche=isma	c17a93886b165970eaf561d65494eb3fc14e	4	Ihre Ausbildung ergänzte sie durch zahlreiche Meisterkurse im In - und Ausland bei großen Pädagogen und Sängern , u.a. bei Kammersänger Prof. Kurt Moll oder Prof. Dunja Vejzovic . Silke Hartstangs umfangreiches Solo - und Duett-Liedrepertoire umfasst zahlreiche Kompositionen und	Liedzyklen	verschiedener Epochen , die sie teils mit Orchesterbegleitung aufführte . U.a. konzertierte sie mit dem Hofgartenorchester Bonn den Liederzyklus " Sea pictures " von Edvard Elgar .	Sg	Coll	Lied	er	0
http://www.sonus-alte-musik.de	94a00f38d6418b46a06450974934a9e0a009	74	Zu hören sind Werke aus der Zeit des 30jährigen Krieges , sowie Kompositionen , die zur Feier des Westfälischen Friedens 1648 entstanden . NOVEMBER 2010 Schwanengesänge Schuberts posthum zusammengestelltem	Liedzyklus	D 957 , betitelt Schwanengesang haben Bassbariton Dominik Wörner und sein Begleiter Christoph Hammer ( Hammerklavier ) nun auf einer wunderbaren neuen CD herausgebracht . - Natürlich nicht nur in bewährt expressiver , dabei aber sehr natürlicher Manier , sondern auch in konsequent historisch-kritischer Herangehensweise .	Sg	Coll	Lied	er	0
