DocURL	DocID	SentID	LC	Match	RC	N2Num	N2Typ	N1Lemma	N1Pl	LE
http://www.feuerwerk-forum.de/archive/index.php/t-22728.html	284ff9674f9353d023293b9bf162d20d0f14	115	Wie kann ich am besten in Erfahrung bringen , wann es an dem geplanten Datum dunkel ist ? Man kann ja Sonnenuntergangszeiten im Netz nachschauen , aber mit der Zeit des	Sonnenuntergangs	ist ja sicherlich nicht die Zeit gemeint wenns dunkel ist , oder ? Also wenn als Zeit fürn Sonnenuntergang 20.45 Uhr angegeben ist , sollte ich wahrscheinlich vorsichtshalber 21.15 Uhr als Abbrennzeit angeben , oder ???	Sg	Ind	Sonne	n	1
http://www.humboldt-forum.de/Flugweb/Web-Site%203/5.1.2.html	53988e3808cd95ee46905a82fd60a445b507	12	Nach Luthers Auslegung war damit die katholische Kirche gemeint . Der Sturz Phaetons aus dem	Sonnenwagen	warnt vor den Folgen von Anmaßung und prophezeit dem Papst ein unglückliches Ende . Unterstützt wird dies durch die Abbildung des Marcus Curtius , der sich kampfesmutig in den Höllenschlund stürzt .	Sg	Ind	Sonne	n	1
http://www.avgoe.de/StarChild/DOCS/STARCH00/questions/question27.html	b2060cd3ffc8ce400420d6a6dc0541497ddb	30	Wasser und Kohlenmonoxid wurden gefunden , wodurch die Theorie des " schmutzigen Schneeballs " bestätigt wurde . Die Ionendichte ( d.h. die Anzahl der Ionen pro cm ³ ) war 100 mal höher als im	Sonnenwind	. ICE kam 7862 km an den Kometen heran und flog mit einer Geschwindigkeit von 20,7 km / Sekunde am Kometen vorbei .	Sg	Ind	Sonne	n	1
http://www.rennwald.de/diktat-klimapolitik.html	b46ed7ef4b81a2927505619af3983d26debf	106	Unser Planet dreht sich exzentrisch um die Sonne . Die Erdachse unterliegt Unwuchten , die Aktivitäten der Sonne selbst können massive klimatische Auswirkungen haben , auch die Magnetfelder erzeugen Klimaeffekte ,	Sonnenwinde	, kosmische Strahlungen . Ebenso verändern die auf der Erde lebenden Organismen ständig Wetter und Klima .	Pl	Ind	Sonne	n	1
http://www.zukunftia.de/500/klapos-telekolleg-aufbruch-zu-fast-neuen-ufern/comment-page-1	1a556c0e379cf95afc3876a2836524b09324	58	Gut , natürlich besteht jedoch noch die Gefahr , dass kleinere Weltraumpartikel aus den Segeln ein optisches Konkurrenzprodukt zu berühmten Milchprodukten der Schweiz formen ... Bereits auf der ISS soll jedoch eine Möglichkeit zur Nutzung des	Sonnenwindes	zur Bahnanhebung erprobt werden . Fazit : Ökotrip im Sonnenschein .	Sg	Ind	Sonne	n	1
http://www.eht-siegmund.de/14.html	aecd1d3bdef610c16ba54818c61405bb7f73	33	Die Leistungskurven von Kollektoren geben die Verhältnisse bei senkrechtem Einfall der Solarstrahlung an . Die Winkelabhängigkeit des Kollektors vomTagesverlauf des	Sonnenwinkels	wird getrennt bestimmt und als Einstrahlwinkel-Korrekturfaktor bezeichnet . Meist wird dieser Faktor weniger beachtet .	Sg	Ind	Sonne	n	1
http://www.scifi-forum.de/off-topic/off-topic-allgemein/9007-gl-ubig-ansichten-religion-en-75.html	45dd3d68d217ed782625f1360e7d3d4cd929	334	Gut , die Psychoanalyse war damals noch eine relativ junge Wissenschaft , aber heute würde vermutlich jeder auf eine pathologische Erklärung tippen . Und dann dieses lustige	Sonnenwunder	, das angeblich von 30.000 Menschen gesehen wurde . Nur so wenige ?	Sg	Ind	Sonne	n	1
http://www.astrologie.de/forum/astrologie-allgemein-f1/auserirdische-zivilisationen--t1080-s120.html	9301afa451ab806080a8124890444b34b562	1	Energie aus Kernfusion kann deshalb keine sinnvolle Alternative sein . © ÖDP Bundesverband Pommergasse 1 97070 Würzburg Tel : 0931 - 40486 0 Fax : 0931 - 40486 29 E-Mail : infooedp.de Newsletter-Abo Spenden Mitgliedschaft Zum Inhalt Astrologie.de THEMEN + INFOS Astrologie Astrologensuche A-Z Esoterik Esoteriksuche A-Z Seminare / Schulungen Präsentationsmöglichkeit für Experten Horoskope / Tarot Was Sie wissen sollten Esoterik Blog Diskussionsforum E-Mail-Beratung TELEFONBERATUNG Astrologie & Horoskope Tarot & Kartenlegen Numerologie Weitere Kategorien HOROSKOPE Persönliches Tageshoroskop Vorschauhoroskope Liebeshoroskop Monats-Liebeshoroskop Monatshoroskope Liebe und Sternzeichen Partnerhoroskop Karmahoroskop Beruf und Berufung Berufshoroskop Persönlichkeitshoroskope Psychologisches Horoskop Jugendhoroskop Kinderhoroskope Sternzeichenhoroskop Chinesisches Horoskop Glückszahlen TAROT 12 Häuser Legung Die 7 Chakren Ägyptisches Tarot Magisches Liebestarot Paartarot Entscheidungstarot Wochenlegung Das Liebesorakel Der Kompass Der Weg Jahreslegung Baum des Lebens Familientarot Mein Zeitplan NUMEROLOGIE Liebeszahlen Numerologische Kurzanalyse Numerologisches Portrait NEWSLETTER ABO INTERN Experte werden Hilfe Sitemap Feedback Impressum Nutzung / Recht AGB Foren-Übersicht ‹ Astrologie-Foren ‹ Astrologie Allgemein Ändere Schriftgröße Chat [ 0 ] FAQ Registrieren Anmelden Astrologie.de | Kostenloses Geburtshoroskop | Horoskope Questico : | Astroshop Außerirdische Zivilisationen ? Diskussionsforum für Einsteiger und allgemeine astrologische Themen Antwort erstellen 161 Beiträge • Seite 9 von 11 • 1 ... 6 , 7 , 8 , 9 , 10 , 11 von proserpina » Di 21. Jan 2003 , 17:19 Lieber Ralf [img]images / smiles / icon_smile . gif ) / img ( Mir ist die Null nicht bei der	Sonnenzählung	entglitten , sondern beim Erdalter , aber inzwischen bin ich schon wieder gar nicht mehr sicher , ob ich da wirklich eine zu wenig hatte . Also 13 bis 14 Milliarden Jahre soll das Universum alt sein und unsere Erde 4,5 Milliarden Jahre ( also hatte ich wohl doch keine Null zuviel ) .	Sg	Ind	Sonne	n	1
