DocURL	DocID	SentID	LC	Match	RC	N2Num	N2Typ	N1Lemma	N1Pl	LE
http://www.kreis-coesfeld.de/Presseinformationen.45.0.html?%26no_cache=1%26tx_ttnews%5Bcat%5D=20%26tx_ttnews%5Bpointer%5D=1	2c1f29e58994fce67eb4ab0577cfd675812f	9	Am kommenden Mittwoch ( 29. Februar ) findet ab 14 Uhr die nächste Sprechstunde der Pflegeberatung im Rathaus in Lüdinghausen , Raum A 10 ( Altbau ) statt . Von der Vergangenheit eingeholt - Katja Thimm liest aus ihrem Buch " Vatertage - Eine deutsche Geschichte " ( 7. Februar 2012 ) Es ist eine sehr intensive Verknüpfung von Lebens - , Leidens - und Zeitgeschichte : Katja Thimm liest am 08. März 2012 um 20:00 Uhr im Kapitelsaal der Burg Lüdinghausen aus ihrem Buch "	Vatertage	- Eine deutsche Geschichte " . Damit spricht sie Literaturfreunde , aber insbesondere auch alle von Demenz ...	Pl	Ind	Vater	U	0
http://www.lyrikwelt.de/rezensionen/vatertagebuch-r.htm	6b1854d0ba6a6889d16ff8b4f2db8238446b	2	" Was für eine Welt , in die diese Generation hineinwachsen muss ! " , notiert Klaus Modick , stolzer Vater zweier jung-erwachsener Töchter , am 11. März 2004 , also am Tag der Terroranschläge in Madrid , in sein "	Vatertagebuch	" . Es gibt originellere Kommentare zu diesem Ereignis .	Sg	Ind	Vater	U	0
http://wiki.diealternativen.de/Herrentag.html	b4d4e7c0f95244768ca4265072cdc86f5961	28	Gemäß den Initianten aus der Männerbewegung ( männer.ch ) soll der Schweizer Vätertag Wertschätzung für väterliches Engagement zum Ausdruck bringen . Im Unterschied zu	Vatertagen	in anderen Ländern besteht der Vätertag in erster Linie in einem Väter-Kinder-Aktionstag und zielt auch auf eine politische Dimension : Die Rahmenbedingungen für ein engagiertes Vatersein in Beruf , Familie und Gesellschaft sollen verbessert werden . Bei der ersten Durchführung am 17. Juni 2007 fanden regionale Veranstaltungen statt und in den Medien wurde über die politischen Forderungen berichtet .	Pl	Ind	Vater	U	0
http://www.sonyuserforum.de/forum/archive/index.php/t-28276.html	662e0047efdfc3231ae6fcbfb1121517185c	113	Kann man es evtl. trinken ?? Wäre doch noch ein lustiger Abschluss des	Vatertages	... :D :D :D Gruß Horst Ich geb einen aus - traust du dich ?	Sg	Ind	Vater	U	0
http://www.rufus-irish-terrier.de/de/irish-terrier-themen.htm	53cb927ae65ee08243dd44d380db87eaa28f	396	Homozygote Tiere wiederum erhöhen die Chance dass diese erwünschten Merkmale auch in der nächsten Generation wieder in der gleichen Form auftreten . Wenn ein Vatertier eine Reihe positiver Eigenschaften besitzt und die Fähigkeit hat , diese Eigenschaften auf seine Nachkommen zu übertragen kann es passieren , dass er zum " Popular Sire " wird , also ein	Vatertier	das von fast jedem während seines ganzen Lebens zur Zucht verwendet wird und vielleicht , dank Tiefgefriersperma , auch noch darüber hinaus . Wenn dann die Kinder und die Enkelkinder gute Eigenschaften haben beginnen die Züchter diese Nachkommen untereinander zu verpaaren .	Sg	Ind	Vater	U	0
http://www.huehner-info.de/forum/archive/index.php/t-9352-p-4.html	6cf80916b6d3ad2239337461e9f8a9c77a31	1374	Daher müssen die Sportzüchter immer wieder etwas " einkreuzen " , wenn sie es mit der Inzucht wieder mal etwas übertrieben haben . Daher predige ich auch immer , dass man in diesem Fall möglichst viele	Vatertiere	einsetzen muss , zumindest alle Hähne , welche 95 P oder gar mehr wert sind , also ich schließe hier in der " Punktewertung " auch die wirtschaftlichen Parameter mit ein . Gesperberte DR und seine Kollegen brauchen sich auch mit dieser vermeintlich " engen Genetik " keine Sorgen machen , wenn sie einerseits möglichst viel ziehen und dann möglichst viele zuchttauglichen Hähne einsetzen , etwa 1,3 - Stämme .	Pl	Ind	Vater	U	0
http://www.walles-pferderat.de/zuchtmethoden.htm	d1a39a84cd547e100f1555d8e25ed9f4d1b6	13	Z.B. durch hereinnahme von Vollblütern , Angelo Arabern oder Vollblutarabern . Sie dient vorwiegend zur Erzeugung von	Vatertieren	4. Kreuzungen Darunter versteht man wenn Pferde verschiedener Rassen miteinander gekreuzt werden . a) Veredlungskreuzung Durch Veredelungskreuzung sollen die Bodenständigen Populationen in ihren Eigenschaften verbessert werden .	Pl	Ind	Vater	U	0
http://soldatenglueck.de/2010/11/page/21	d60f7ab5cf880824c5a706225e7202bb03d2	13	Angesichts der fünf weiteren Rudel in der sächsischen Lausitz bestehe jedoch Hoffnung , dass diese Lücke geschlossen werde . Der Verlust des	Vatertieres	bedeute für die Welpen des Rudels den Wegfall eines Versorgers . Die im Rudel lebenden Jährlinge können jedoch als erfahrene Geschwister bei der Aufzucht helfen .	Sg	Ind	Vater	U	0
http://www.draesner.de/de/buecher/lichtpause	042d6d9513d5c28adbae60d8d7e18fdeeb2b	56	Man muß sich den Weg durch das dichte Neuland sprachlicher Figuren erst bahnen , durch die Zeitsprünge , rätselhaften Verknüpfungen und die vielen Wortschöpfungen . Leichthändig verdichtet Draesner komplizierte Gefüge im treffenden Bild : Hildes " Abhängigkeitsfüße " stehen unter dem "	Vatertisch	" , die Familie fährt " im Schwitzkasten der Vateridee " in Urlaub . In ungewöhnlicher Perspektive wird wie von außen und innen zugleich erzählt : " Ich bin damals und heute .	Sg	Ind	Vater	U	0
http://www.heinrich-tischner.de/21-th/2bibel/theol/gt-bild/iia.htm	4a43469c065c285202a4f563c6581cd53a22	74	) 169 ( Wenn wir weiter nichts über Jesus wüssten als dies , müssten wir allein daraus entnehmen , dass Jesus zu Gott ein besonders inniges Verhältnis gehabt hat . Wie uns nun aber das Neue Testament zeigt , hat Jesus den	Vatertitel	für Gott nicht ausschließlich für sein persönliches Gottesverhältnis gebraucht ; er redet auch den Jüngern gegenüber von " deinem Vater " , ) 170 ( " eurem Vater " ) 171 ( oder " eurem Vater im Himmel " ) 172 ( . Und er lehrt seine Jünger beten wie er es selbst getan hat : " Vater " ) 173 ( oder " Unser Vater im Himmel " .	Sg	Ind	Vater	U	0
http://www.elitepartner.ch/forum/hat-jede-frau-einen-kinderwunsch-wenn-43054.html	e36980fe028231480effa113852237956c56	178	Ich hoffe es trägt nur wieder nicht zum Klischee bei , attraktiver , lebensfroher , aktiver Mann kann kein Vater sein , sondern nur der bodenständige Beamtentyp , aber der wäre für mich zu langweilig - so nach dem Motto . Es gibt keinen Mann , der potentieller	Vatertyp	ist oder nicht , es gibt Männer , die sich als regelrechte Superväter entpuppen und ihr Kind vergöttern , sogar bei Scheidung wie ein Löwe um das Sorgerecht streiten und es gibt Väter , denen die Kinder wurschtegal sind , auch Spießer können so sein . Gilt für Mütter ebenso - logisch .	Sg	Ind	Vater	U	0
http://www2.uni-wuppertal.de/einrichtungen/gleichstellung/wege_wiss.html	fae0801b95062a3f27e352abb8f30d5bed71	31	Aufgrund dessen sehen sich Akademikerinnen mit Kind(ern) noch stärker als kinderlose Akademikerinnen dazu aufgefordert , ihre wissenschaftliche Exzellenz und akademische Befähigung unter Beweis zu stellen . Die Unvereinbarkeit von Wissenschaft und Kind(ern) wird auch noch an einem weiteren Punkt deutlich : die wenigen Männer , die vom traditionellen	Vatertypus	abweichen und sich zu einer aktiven Vaterschaft bekennen , werden hinsichtlich ihres akademischen Persönlichkeitsprofils genauso diskreditiert wie Frauen . weitere Infos ...	Sg	Ind	Vater	U	0
http://www.vaeter-aktuell.de/Kueng_Vatersein_20060702.htm	48b5662c40f3b443d46127979709814526f4	55	Hier sind die negativen Folgen für die Kinder am deutlichsten erkennbar , mit oft verhängnisvollen Auswirkungen , die den betroffenen Kindern und Jugendlichen nicht selten für das ganze Leben eine Prägung geben und oft schwer heilbar sind . Die Ursachen sind komplexer Art , sie hängen mit dem	Vaterverlust	, aber auch mit einer Reihe von anderen Faktoren zusammen wie der Reaktion der Mutter auf die Trennung , das Auftreten wirtschaftlicher Probleme , eventueller Wechsel der Wohnung , der Schule , des Freundeskreises usw. Vor allem stellt der Konflikt der Eltern vor , während und nach der Scheidung eine besondere Belastung für die Kinder dar .	Sg	Ind	Vater	U	0
http://www.trennungsvaeter.de/vaterlosigkeit.html	a4875953aa615a85af1dd47b7ad94b11ecd2	3	Kinder brauchen beide Eltern ! Die psychosozialen Folgen des	Vaterverlusts	sind ein vergleichbares Trauma wie beim Verlust der Mutter . Vaterlosigkeit führt zu : mehr Selbsttötungen mehr Schwangerschaften bei Teenagern mehr Ausreißern und obdachlosen Kindern mehr Jugendlichen in staatlichen Einrichtungen mehr jugendlichen Häftlingen mehr Schulabbrechern mehr Heranwachsenden mit Drogenproblemen mehr Verhaltensstörungen bei Kindern und Jugendlichen Auswirkungen der Vaterlosigkeit auf die Gesellschaft Problemsituation : Nahezu alle unsere Mitglieder - egal , ob Mütter oder Väter - sind unverschuldet von massiven Problemen im Umgangs - und / oder Sorgerecht mit ihren Kindern betroffen .	Sg	Ind	Vater	U	0
http://www.culturactif.ch/inedits/mettler2.htm	7428412f005d18f849ae58b870eb19f0e77d	11	Sie beginnen stets im Bahnhof von Aarau , einer ferrovialen Vorzugslage zwischen Basel und Zürich , übertroffen nur noch von Olten , dem eisenbahnerischen Zentralgestirn . Militärdienst und Wanderei , diese beiden Kernbereiche der	Vaterwelt	werden bald schon enggeführt sein , wenn wir im Innern der Massive unserem Ziel entgegendonnern , dem Puschlav - dann also , wenn sich der Zug in meinem Kopf dem › Réduit ‹ nähert , jenen fabulösen Festungsbunkern , die aus dem Alpenfels gehauen sind . In ihren dunklen Bäuchen , denke ich , am Grenzpunkt zwischen bekannter und unbekannter Welt , müssen die Frontkämpfer der Heimatliebe auf ihren Einsatz warten .	Sg	Ind	Vater	U	0
http://www.seniorentreff.de/diskussion/archiv4/a298.html	57aa24c72f9aeb975fa44f221aef606a4922	48	Du hüllst mic h in Dein Leben ein und lehrst mich , so wie du zu lachen . Ich sehnte mich nach Mutterlieb und	Vaterwort	und Frühlingsspielen . den Fluch , der mich durchs Leen trieb Begann ich , da er bei mir blieb , wie einen treuen Freund zu lieben .	Sg	Ind	Vater	U	0
http://www.lothar-bross.de/Vaterbriefe/Vaterbriefe%203.Bd/Anhang/13.htm	2d5a6b59f2078a3e8f9dc4defa625d5667e8	6	Meine Liebe hat dir dieses Pfand also anvertraut , dem Anscheine nach scheint es zwar benachtheiligt , aber es hat gerade so viel Fähigkeit in sich , einst eine schöne Himmelsblume zu werden , wie jedes andere . Daher komme du mit deinem liebenden Vaterherzen nur fleißig zu Mir um Beistand , so will Ich dir ( innerlich ) die Anleitung shcon geben , damit du dieses Kind so erziehen kannst , daß es dir ebensoviel Freude macht , wie ein anderes ; nur mußt du die wahre Freude , welche seine Entwicklung hervorbringt , erst selbst recht schätzen lernen , es ist die Liebe ; wird dieselbe recht in das Herz des Kindes gelegt , so können sich in demselben Tugenden entfalten , die jedes ganz Gesunde beschämen . Es ist dieß ja gar oft bei solchen Personen der Fall , daß die Seele , die gehindert ist durch ihre 8 mangelhaften ) Organe sich mehr mit dem weltlichen Treiben zu befassen , dafür sich mehr vergeistigt ; siehe , dieses stelle Ich auch dir in Aussicht , so du mit Mir Hand in Hand deine Vaterpflichten nach Meinem Sinne ausübst Sorge daher , daß dein Kind überall mit Liebe behandelt wird , hauptsächlich auch von Lehrer und Lehrerin , welche meist mehr darauf sehen , daß das Kind gut gelehrt ist und ihre eigene Ehre darin suchen , auf das Kind gut gelehrt ist und ihre eigene Ehre darin suchen , auf Kosten der (Ueber-)Anstrengung des Kindes ; lasse es leiber in diesem Alter noch kindischem Spiele über , und gib ihr Gelegenheit Andere mit kleinen Gaben zu erfreuen ; die Dankbarkeit und Freundlichkeit der Gesichter der Beschenkten wird wückwirken auf dasselbe , und daran gewöhnt , wird sie auch oft edlere glückliche Stunden zu genießen haben , bei ihrem unschuldigen Wesen , das nicht so viel inne wird von dem Mißbrauch der Zunge , als da ist Afterreden , Fluchen , Schwören u. ; ohnmächtig und rein hast du dieses Pfund in deinen Händen , und Ich werde einst nicht mehr von diesem Pfunde von dir verlangen , als dir möglich war ; doch kannst du dasselbe leichter einst als eine Gnadengabe Mir wieder zustellen , denn ein 8 oft zu sehr ) schönes und begabtes Kind , das allen Versuchungen ausgesetzt ist , und daher oft mehr unterliegt , leiblich zwar eine Zierde , aber dagegen geistig ( leicht ) verkrüppelt . Dieß Meine	Vaterworte	an Meinen Sohn , der in Meine Erziehungsschule eingetreten ist ! Amen ! D a s L i b e r a l e T a g e b u c h Sammlung Originaldokumente aus " Das Liberale Tagebuch " , uriblank Redaktion : Ein seichter Text der sog. Grünen Technisch und ökologisch machbar Mehrere Studien belegen , dass die Umstellung des Energiebedarfs auf erneuerbare Energien bis 2050 zu schaffen ist .	Pl	Ind	Vater	U	0
http://blogs.hr-online.de/lateline/2011/06/12/montag-lateline-ist-in-oder-out	61036385b26db2077a345ef7daee810b209e	78	Es sei schlicht das Familienmodell , mit dem sie sich beide am wohlsten fühlen würden . Dass andere Männer sich anders entscheiden , hält Petry für " normal " - und denkt darüber nach , beim zweiten Kind zwei Monate in	Vaterzeit	zu gehen . Sofern es mit dem Job vereinbar ist .	Sg	Ind	Vater	U	0
