DocURL	DocID	SentID	LC	Match	RC	N2Num	N2Typ	N1Lemma	N1Pl	LE
http://www.bruni-prasske.de/kurzgeschtexte/abtaucheninbadenbaden/abtauchenin1.html	b92b2ae9ced6598fd1342f5cd9d1910bc975	4	Bei 68 ° wird ein kurzer Aufenthalt empfohlen . Hier sind die Kacheln mit	Vögelpärchen	verziert . Papageien scheinen sich verliebt anzuschauen , ein Schwanenpaar zieht übers Wasser und ein Hahn baut sich in all seiner Pracht vor einer schlichten Henne auf .	Pl	Coll	Vogel	U	1
http://www.dashaustierforum.de/agaporniden/aga-haben-den-schwaechsten-zerhackt-t6549.html	6f0dd92ae7c1eb948e2326f598f4749e2179	89	Weder sind Agaporniden süchtig nach Flüssigkeiten aus den Federenden , noch stehen sie auf " süsses Blut " !!! So einen Schwachsinn gibts in der	Vögelwelt	nicht !!! Das einzige , was es in der Art gibt ist " saures Blut " beim Menschen der auf Grund Krankheitsbilder sehr viele Medikamente nehmen muss .	Sg	Ind	Vogel	U	1
http://www.buergerzeitung-duisburg.de/Kulturweb/mar%20apr2009.htm	53395e8ca533a633e45c611319e662aa87f6	41	Ein Besuch lohnt sich auf jeden Fall . Es gibt lebende Vögel ( in Käfigen ) genauso wie	Vögelskulpturen	( aus Holzblöcken ) zu sehen ; die Holzspäne auf dem Fußboden zeugen von der künstlerischen Arbeit . Diese Ausstellung ist eine angenehme Abwechslung zu dem drögen Allerlei , den man sonst geboten bekommt .	Pl	Ind	Vogel	U	1
http://www.tabletopwelt.de/forum/archive/index.php/t-6688.html	340f529b1bded1a30682de1aaa79b4eade74	101	Also absoluter Quark . Das geschlossene System würde bedeuten , wie du vermutest , daß durch das	Vögelflattern	deren Kraft gegen den LKW wirkt - genauer , gegen seine " Anziehungskraft " . In einem solchen geschlossenen System gibt es aber auch wirklich NICHTS von außerhalb - richtig , auch keine Gravitation , und damit wäre dann der LKW im Prinzip schwerelos ... und das ganze ziemlich sinnlos .	Sg	Ind	Vogel	U	1
http://www.nymphensittichwelt.de/vbulletin/archive/index.php/t-6029.html	4ae433720a122f209a30ab4251a4eaf35602	138	Ich hab jetzt alles weggemacht , Gardinen auch . Was ich noch frafen wollte ist , ob die Infrarot Lampe den	Vögelaugen	irgendwelchen Schaden zuführen kann ?? weil die Spirale glüht ganz schön ?	Pl	Ind	Vogel	U	1
