DocURL	DocID	SentID	LC	Match	RC	N2Num	N2Typ	N1Lemma	N1Pl	LE
http://www.heimatfreunde-aussig.de/korektur.htm	14c99f930aa3177fae27173c4b4bec5d2fe0	13	Schiffswerften , Vinola , Solvay-Sodawerk ( TONASO ) , Schleusen mit Stoney-Anlage und Hydrozentrale von 1923 - 1935 u. a. . Im ZOO ( früher der Lumpe-Park mit	Vögelreservation	) richtete man einen Lehrweg mit hölzernen Dinosauriern , einer Mini-Burg und einer Tierausstellung ein . Zu den Merkmalen der Stadt gehören der Marienberg , Aussichtsgaststätte Ferdinandshöhe ( Vetruše ) und weitere Gipfel des böhmischen Mittelgebirges .	Sg	Ind	Vogel	U	1
http://www.standardwellensittichzucht-lenk.de/artikel34.html	33e3bc71aa0b27bfc9a1f0356f0cfba83906	103	So ein Wellensittich ist , wie alle Ausstellungszüchter wissen für ewig nicht mehr ausstellbar . Nach dem ich wieder einmal mit einem sehr guten Jungvogel davon betroffen war , es war mein bester Jungvogel von der Zuchtsaison Ringschere Die im Bild dargestellte Ringschere ist speziell zum trennen von Ringen an	Vögelfüßen	konstruiert worden . Mit ihr ist es sehr leicht einen Ring von einem Vogelfuß zu trennen .	Pl	Ind	Vogel	U	1
http://www.kakadu-info.de/forum/archive/index.php/thread-599-3.html	c98a1a7347ecb774abbaa7ae94b001941a62	14	Das andauernde saubermachen geht mir richtig auf die Nerven - das STIMMT . Ich glaube aber nicht das alle Papageienbesitzer davon begeistert sind das sie andauernd die	Vögelscheisse	bei sich zuhause wegmachen können . Aber ich hab mich damit abgefunden - ich musste mich damit abfinden .	Pl	Ind	Vogel	U	1
http://www.roma-antiqua.de/forum/rom_24/endlich_mal_rom_etwas_verspaeteter-10634-print-2	608be0a2816de1c5a9b75dcfe9fb84d2bc58	20	Herzlichen Dank dafür und vor allen Dingen für die Aufnahmen . Die Bilder von den	Vögelkonturen	nachbildenden Vogelschwärmen sind sensationell . Nach dem Betrachten aller anderen Aufnahmen ist man versucht zu beschließen , selbst nie wieder seine ' Schnappschüsse ' hier im Forum zu veröffentlichen meint tacitus FestiNalente 06.01.2010 17:14 Den Worten von Tacitus ist nichts hinzuzufügen :thumbup: Ich bin - mit vielen - gespannt auf die Fortzetzung !	Pl	Ind	Vogel	U	1
http://www.fellfussel.de/Afrika/Namibia89.htm	f330b6fc064d4b645aff081dd10bf6c023f3	504	Dafür treffen wir unterwegs zwei schöne Kudus ! Später versuchen wir uns im	Vögelfilmen	. Zuerst sehen wir eine Toko-Familie , die aber recht scheu sind .	Pl	Ind	Vogel	U	1
http://vogelforum.digiwurm.de/wichtig-dohlennest-mit-eiern-drin/comment-page-1	c9a9177bedfe43f5b35e83236e6c5243a72d	22	Ich würde mit den Eiern nichts machen . Wenn es schon	Vögelküken	wären , dann klar , würde ich sie aufpäppeln , aber da sie ja noch nicht geschlüpft sind , würde ich sie lassen . Sie sind sicher so oder so nicht mehr zu retten , weil die Eier , ab einer gewissen Reife , permanent gewärmt werden müssen .	Pl	Ind	Vogel	U	1
http://www.nymphensittichforen.de/beitrag19102.html	0d5cbdaa7b3fa8294f9c1a4334965001bfd8	66	Weiß nicht wo du her kommst , aber kann Dir sonst auch Zoo-Phoenix.de empfehlen ! Die Vögel dort leben und großen	Vögelzimmern	in großen Schwärmen , sind ein wenig zahm . Die Leute dort haben Ahnung von Nymphensittich !!	Pl	Ind	Vogel	U	1
http://www.africanhunters.de/7.html	cd4fe98b8920129c1559ea193e112a2e4901	44	Auch hier gilt wie immer auf der Jagd : Nicht das Kaliber ist allen entscheidend , sondern die Treffpunktlage des Schusses . Für Auerwild und Birkwild empfehlen wir .222 Remington oder .223 Remington , da beide Kaliber verhältnismäßig weite Schüsse vertragen und die	Vögelkörper	schonen . Andere ähnliche Kaliber sind ebenso brauchbar .	Pl	Ind	Vogel	U	1
http://www.buchen-sie-mv.de/ruegen-und-hiddensee.html	5fd8877aa74281716712f3d8ca55b13948b1	21	Rügen bietet für jeden Urlauber etwas und das nur nicht im Sommer ? der Hauptsaison . Immer mehr Urlauber sind begeistert von der ruhigen Winterlandschaft Rügens sowie den	Vögelzügen	in Frühjahr und Herbst . Auf Rügen und Hiddensee bieten wir Ihnen die folgenden Unterkünfte an : Weitere Unterkünfte finden Sie im Online-Buchungssystem : Sollten Sie bei den Unterkünften unserer Gastgeber kein passendes Angebot und keine passende Unterkunft mehr finden , empfehlen wir Ihnen unser Online-Buchungssystem , welches Ihnen freie und direkt buchbare Urlaubsunterkünfte auch anderer Anbieter auf Rügen und Hiddensee anzeigt .	Pl	Ind	Vogel	U	1
http://www.tczew-witten.de/aktuell/2004a/a041031.html	2602edbb65f00fd7d9065c7c47c65695666b	21	Kann man den Geruch wahrnehmen , um die Freiheit zu spüren ? - Besonders im Frühling , wenn die	Vögelgebrüder	zusammen im Orchester singen und versetzen sich von Platz zu Platz ? Doch riskiere ich es und nenne es den Geruch : Die Vögel riechen nach frischem Hefekuchen aus Omas Ofen , den sie kurz vor Ostern gebacken hat .	Pl	Coll	Vogel	U	1
http://www.yellopet.de/voegel-beitrag-8792.htm	8942ef0a0124c6bd6e0137e1ec172ae8194d	20	Mache jetzt den Käfig auf . » User # 5255 schrieb : Hallo , bring die Elter doch zu einem TA oder einer	Vögelstation	oder so . Aber lass sie doch nicht von einer Katze oder so holen .	Sg	Ind	Vogel	U	1
http://immerlicht.over-blog.de/m/article-56352184.html	c52569afbff3aabf40eb7d00d5c12f8b7884	12	Ansonsten könntest du die Himmelswache der Sha ' tar auf ehrfürchtig bringen und dir die Netherrochen holen . Man kann Dailys machen sowie diese	Vögelmobs	kloppen , aber je nach Rufstand kann das ganz schön dauern . Da würd ich dir eher die Kurenai empfehlen .	Pl	Coll	Vogel	U	1
http://www.pennys-wochenrueckblicke.de/2006_03_01_archive.html	0682925a4f59615d636dd8cb764e0dc63785	83	Vielleicht ist es aber auch schade , dass eine derartige Klage-Kultur in Deutschland nicht existiert . Wäre doch toll , lauter Leute die	Vögelverkäufer	aus Zoohandlungen vor den Kadi zerren , weil sie Panikanfälle bei jeder Erkältung bekommen . Da hätten selbst die Schöffen endlich mal wieder nen Grund zum Lachen .	Pl	Ind	Vogel	U	1
http://www.mik-ina.de/2010/11/07/mach-das-internet-schlau/comment-page-1	1097e47d27b4dcd7caf66f2b6f39f42f8419	21	Macht man nicht . Also nein . wie das Auto vor	Vögelkacke	schützen ? Vor was ?? Ach so Garage . wenn eine Ware das Lager verlassen hat , wann kommt sie dann ?	Sg	Ind	Vogel	U	1
http://www.pentaxinfo.de/forum/archive/index.php?t-2319.html	bf64b2acdf424e5d1dc4348ff1cd5c67c9e9	41	So kann man natürlich nicht fotografieren . Bei	Vögelfotografie	würde ich AF-C einstellen , dann führt der AF automatisch mit . Mit einfachen Worten : Ein beweglicher AF !	Pl	Ind	Vogel	U	1
http://www.planeta-verde.de/reisen/Brasilien-Pantanal/unterkunfte.php	bbd208a26213b298280ba56b6f000b5f52e7	31	Insgesamt ist die Fazenda aufgrund einer beeindruckenden Artenvielfalt am besten geeignet für Naturliebhaber und Naturfotografen . Pousada Pouso Alegre Diese Jahrzehnte alte Rinderfarm , die den Rücken zur traditionellen Rinderzucht gekehrt hat ( diese wird nur für den eigenen Bedarf weitergeführt ) hat große Bedeutung durch ein Araschutz-Projekt erlangt , welches die Fazenda zu einer Art Mekka für	Vögelfreunde	aus aller Welt werden ließ . Der Grund des extraordinären Vogelreichtums ist der Bento Gomes Fluss , welcher die 11.000 Hektar große Fazenda durchquert , und während der großen Trockenzeit von Mai bis Oktober fast vollständig austrocknet .	Pl	Ind	Vogel	U	1
http://www.hgv-ehningen.de/strassen.htm	0ad9202be0d3ecc1694f8bbd9c103a725be9	725	Der Zeisig gehört zu der Gattung der Finken . Diese Straße im Gebiet " Herdstelle " wurde wie einige andere auch nach einer heimischen	Vögelgattung	benannt . Ziegelweg Die Ziegelhütte , wo der in der Gemarkung Ehningen in großer Menge vorkommende Lehm gebrannt wurde , befand sich am südwestlichen Dorfrand .	Sg	Ind	Vogel	U	1
http://www.vogel-portal.de/forum/archive/index.php?t-39368.html	d7ee05d92b38259dd985793843a83ea32d45	59	Mein Gott ihr pflegt wieder eine Kultur ohne gleichen . Allesamt die	Vögelhalten	ob hier oder wo anders haben immer 100 % die Legalität gepachtet ...! Hier seh ich kein Verzug und keinerlei Kriminelle Tätigkeiten .	Pl	Ind	Vogel	U	1
http://www.doctorsdiaryfanforum.de/t2682f146-Kommentare-zur-Story-von-Kate-12.html	4646217fa632e42764ed47bb9b8d05bc88cf	92	Sissi Majestät , es wird ja immer bunter , niemand hier zieht die Kaiserin runter , alles ist nur der Spannung geschuldet , es wäre schön , wenn Ihr das erduldet . Pinklady Rosa Dame hat es mit den	Vögelsorten	, traumhaft sicher jongliert sie mit Worten . Pinky , Du bist eine Pfundsgranate , den Storch ich zu jeder Zeit Dir gern brate .	Pl	Ind	Vogel	U	1
http://www.jiggle.de/vb/fussball/51500-jiggle-bundesliga-tippspiel-saison-2011-2012-a.html	ad644f7b481bbf30c6af4adbc7c2757dc887	34	Da hast du wohl recht . nach oben # 17 ( permalink ) 04 - 08 -2011 , 23:55 - Jiggle Bundesliga Tippspiel Saison 2011 / 2012 Rocky Extremposter Level -1 - Registriert seit : Sep 2008 Alter : 45 Beiträge : 3.146 Borussia Dortmund - Hamburger SV 1:1 SV Werder Bremen - 1. FC Kaiserslautern 3:1 Hannover 96 - 1899 Hoffenheim 2:2 1. FSV Mainz 05 - Bayer 04 Leverkusen 1:3 VfB Stuttgart - FC Schalke 04 1:1 1. FC Köln - VfL Wolfsburg 2:1 FC Augsburg - Sport-Club Freiburg 1:1 Hertha BSC - 1. FC Nürnberg 2:1 FC Bayern München - Borussia Mönchengladbach 4:1 _ _ _ _ _ _ _ _ _ _ _ _ _ _ _ _ _ _ Mensch , ärgere Dich nicht - lieber die anderen ! nach oben # 18 ( permalink ) 05 - 08 -2011 , 16:01 - Jiggle Bundesliga Tippspiel Saison 2011 / 2012 Ach komm du	Vögelexperte	. Wer Breitwandbilder machen kann , der hat auch ein wenig Ahnung von Fußball ...	Sg	Ind	Vogel	U	1
http://www.lexikus.de/bibliothek/Die-Kinder-des-Kapitaen-Grant	5c534eb385d23cdad49538545d081f15e872	18	Das Fort Independence . Die Hochflut . Worin man nach	Vögelweise	lebt . Worin man noch immer nach Vogelweise lebt .	Sg	Ind	Vogel	U	1
http://www.imloop.de/archiv/looparc/loop188.htm	4e89c74349301973e5f45be2bdc59af203bd	301	Juhu Leute , Sonntag !	Vögelschlägerei	in der Birke ! Go , Spatz , go ! Schnapp dir den Wurm , Yiha ! Sasa - 11.01.04 at 12:25:0 3 u n s t o l z Sasa - 11.01.04 at 05:30:0 4 Implied Author . Sasa - 11.01.04 at 04:11:2 3 Ich denke nicht , dass ich ein Zauberer bin .	Sg	Ind	Vogel	U	1
http://www.frankreich-sued.de/prominente-server/Georges%20Braque/Georges%20Braque.htm	9d3ce7edf3b8cf7be18d24eea32bf49e95fc	7	Nach dem Ersten Weltkrieg , bei dem Braque verwundet wurde , war sein Kontakt zu Picasso nahezu abgebrochen ; Braque arbeitete wieder vermehrt mit der Farbe als Ausdrucksmittel . Nach dem Zweiten Weltkrieg entstanden vor allem seine " Atelier - und	Vögelbilder	" . Braque zählt zu den wichtigsten Künstlern der Moderne , der außerdem die französische Tradition der Landschaftsmalerei aufrechterhielt .	Pl	Ind	Vogel	U	1
http://vogelforum.digiwurm.de/was-ist-mit-einem-hahn-los-der-nonstop-kraeht/comment-page-1	810a83302f8f6d872a584b4c43d97836c664	24	Mit dem Krähen markiert der Hahn sein Revier . Da wir uns dem Frühling nähern und schon einige	Vögelscharen	aus ihren Winterquartieren zurückgekehrt sind , sollte man annehmen , dass der Hahn Frühlingsgefühle hat und seine Hennen ruft . Besseres fällt mir dazu nicht ein !	Pl	Coll	Vogel	U	1
http://wow.ingame.de/forum/beta-tagebuecher-1409/lieber-tagebuch-177818/seite-2	41624a583959f9d6b0a2d94af23beafb8f4a	140	Die sind auch jetzt Live . Hm ... jetzt bin ich schon wieder in so ein kleines Lager gelandet , mit Tauren und so ein Nachtelfen , da durfte ich die	Vögelviecher	töten und solche Natta aufsammeln , danach durfte ich mit so ein Zauberteil die Vögel säubern , manchmal explodierten sie , manchmal wurden sie sehr böse auf mich , oder sie wurden Freundlich , also es sind schon Lustige dinge eingebaut wurden . Später musste ich ein Ritual mit diesen Nachtelfen machen , dort kam Schwarze böse Tiere und Dämonen raus , ich sollte dort diesen Riesen Kugelvieh , denn man aus Blutkessel kennt ( 2. boss ) töten , so hatte ich auch die Quest fertig .	Pl	Ind	Vogel	U	1
http://www.halobase.de/forum/archive/index.php/t-5593.html	6c158d39629c993e80b21af4ba722fe152d5	578	uriblank uriblank uriblank uriblank sehen süß aus , gibts für tiere einen eigenen kurierdienst oder verkaufst du sie nur per selbstabholung ? 01.04.2009 , 23:28 Ja , ur süß ... bin sowieso ein	Vögelfanatiker	:D Wenn du sie schicken würdest ( kA wie , vielleicht ists ja möglich ) , melde ich hier auch mal Interesse an . GreeZ , Rtas ' Vadum . Scarface 88 01.04.2009 , 23:32 Die haben nicht zufällig einen Schein vom Veterinär , womit man die über die Grenze nehmen kann ?	Sg	Ind	Vogel	U	1
http://www.kakadu-info.de/forum/archive/index.php/thread-1542.html	b774cbe3dbe31cd010f360181e8dfa186201	1	: Respect : Ich persönlich brauch ja keine HVA , aber einem jeden das Seine ! vBulletin® v 4.0.8 , Copyright © 2000 - 2011 , Jelsoft Enterprises Ltd . Kakadu-Forum Kakadu-Forum > Alles über Kakadus - und auch andere Papageienarten - > Anfänger > Möchte gerne Erfahrung austauschen Normale Version : Möchte gerne Erfahrung austauschen Du siehst gerade eine vereinfachte Darstellung unserer Inhalte . Normale Ansicht mit richtiger Formatierung . Little Devils 12.07.2010 , 21:45 Hallo Ihr lieben	Vögelbesitzer	, dachdem ich seit dem 2. Februar 2010 einen 12 Jahre jungen Kakadu von meiner Tante bekommen habe ist ganz schön viel passiert . Ich habe mir immer einen großen Papageienvogel gewünscht habe mich vorher im Internet und in Büchern belesen , hatte unterdessen ganz schön viel Respekt vor meiner bevorstehenden Situation mit dem Vogel , aber wollte meinen Traum mir gerne erfüllen .	Pl	Ind	Vogel	U	1
http://chaineux.de/myforum/archiv/topic_2101.html	23a78ea83ab62fb621ef37f08d3ebc52f073	62	Kehre um , Königssohn ! " Anfangs wollte er diesem	Vögelgeplauder	keinen Glauben schenken ; als er sich endlich doch entschloss genauer nachzusehen , fand er , dass sich bezüglich des Mädchens Alles so verhielt , wie die Vögel verkündet hatten . Da nahm er einen Zauberstab und legte ihn ihr über die Schultern .	Sg	Ind	Vogel	U	1
http://www.totontli.de/category/vogel/vogelbucher-cd-dvd-sofware/langswitch_lang/de	6bc361d8074836aa71e7dade91822af798ff	160	Durch den Erfolg seines Blogs wurde der Soldat Trouern-Trend schließlich dazu ermutigt , aus seinen Erfahrungen ein kleines Buch zu machen , das 2006 in den USA und schließlich 2009 in Deutschland erschienen ist . Für das Büchlein wurden die besten Blogeinträge von 2004 / 2005 noch einmal editiert und mit kleinen schwarz-weißen	Vögelbildchen	versehen . Der Autor beschreibt in seinem Tagebuch die beobachteten Vögel und deren Verhalten , was für Vögelfans sicher interessant ist , sich aber stellenweise etwas langweilig liest .	Pl	Ind	Vogel	U	1
http://www.iwr.de/guest/wibo984.html	fbb2e66f1f940e2339322fe844eba2e82aac	62	MfG Simon Steinle Simon Steinle Ehingen , Baden-Wütemberg Deutschland / Germany - Monday , October 12 , 1998 at 14:31:3 1 ( MES ) Bitte um Informationen bezüglich Naturschutz beim Bau von WKA . Insbesondere Landschaftsschutz und	Vögelbeeinträchtigung	, Brutverhalten usw. Für Ihre Info danke ich sehr herzlich .	Sg	Ind	Vogel	U	1
http://www.vogelforen.de/archive/index.php/t-209470.html	7763c26a3c60ab70ce7f91379a374967a69e	116	Der größte Witz : Der Teich , an dem sie jetzt noch leben , ist von der Wasserqualität her vollkommen in Ordnung - amtlich bestätigt ! Pikantes Detail am Rande : Federführend bei der	Vögeldiffamierung	ist ein Mitglied einer bekannten Naturschutzorga ... : k Was unsere Kanadagänse , Nil - und Graugäns angeht , gibt es bei uns seit dem letzten Jahr eine " Ausnahmegenehmigung " : Ab Mitte Juli darf geschossen werden !	Sg	Ind	Vogel	U	1
http://technik.toppshopp.de/DVD.13628941/6.Gro%C3%AF%C2%BF%C2%BD%C3%AF%C2%BF%C2%BDbritannien.de.html	2db5533c6362ec4a5637a855d8e3c38497f6	285	Die Grundidee ( Fuzzy ( der sich für einen hochmodernen Don Giovanni hält ) greift ständig Frauen ab , weil Vögeln und Fernsehen die einzige Beschäftigung sind , die er ' kann ' ) würde fürn kleines Fernsehspiel reichen . Schließlich kommt er auf die Idee , es mit Allein " erziehenden " ( Alleinverwahrlosende wäre wohl der bessere Ausdruck ) zu probieren , weil die von sich aus die	Vögelbeziehung	beenden und er nicht mehr den schwarzen Peter hat , gähn . Schließlich trifft er auf einen optisch und haptisch denkbar langweiligen Jungen , dessen einzige Beharrlichkeit darin besteht , Hugh Grant auf die Nerven zu gehen , bis die beiden gemeinsam fernsehen !	Sg	Ind	Vogel	U	1
http://www.lostindeutschland.de/lid/video/71	9b2f8d33cefc3a6ba18912536c94dbb8ca19	5	Dann passen Sie auf , wenn Sie das nächste Mal an einem Optiker vorbeilaufen . Da werden Sie sehen , wie Brillen in einer Reihe mit Vögeln angeboten wird , wie Brillen gar in	Vögelnestern	schlüpfen . Und nicht nur Vögel .	Pl	Ind	Vogel	U	1
http://forum.garten-pur.de/Naturfotografie-39/Neue-Moderatorin-608_15A.htm	9acba48dd681388f520370897d31a8e75176	8	Seisdrum , fein , dass du auf meiner HP warst , allerdings ist sie immer noch im Aufbau - und auch was Tiere im Garten / Bienen angeht , habe ich erst letztes Jahr damit angefangen , aber es ist spannend .. denke , nein falsch , freue mich schon auf das Frühjahr - außer Pflänzchen weitere schöne Tieraufnahmen einfangen zu können . Jetzt im Winter mache ich nur	Vögelfotos	. Zu Weihnachten habe ich mir einen DIA-Scanner schenken lassen .	Pl	Ind	Vogel	U	1
http://www.tczew-witten.de/aktuell/2004a/a041031.html	2602edbb65f00fd7d9065c7c47c65695666b	18	Früher habe ich sehr grosse Gobelins als sichere Vogelnester gewebt . Heute webe ich gerne die	Vögelflüge	im Raum . Wie riecht der Vogelflug ?	Pl	Ind	Vogel	U	1
http://www.gebaeudereinigungstallmann.de/category/haushaltstipps	1edc379745ddfbb1ab9a119e855f7ec92adf	36	Wer heimische Pflanzen und abwechslungsreiche Strukturen in seinen Garten bringt , bietet Nützlingen einen idealen Lebensraum . Auch Hecken , kleine Holz - und Steinhaufen oder Nisthilfen wie	Vögelhäuser	ziehen die kleinen Helfer an . Raubmilben gegen Spinnmilben Spinnmilben ernähren sich von Pflanzenteilen .	Pl	Ind	Vogel	U	1
http://www.fliegenfischer-forum.de/kroatie2.html	cb43e56cc39d4babe2d44cfc88c91e612d32	8	Der Naturpark Vransko See Dieser liegt zwischen den Städten Zadar und Sibenik und ist der größte See in Kroatien . Der Vransko See ist sowohl für sein großes	Vögelvorkommen	aber natürlich auch für Fischvorkommen bekannt . Im See tummeln sich Hechte , Aale , Meeräschen und viele weitere Fischarten .	Sg	Coll	Vogel	U	1
http://www.zuerchertierschutz.ch/de/projekte/wildtiere/wiederansiedlung-des-bartgeiers.html	147e366e4a54de9085e57e3a62077ed50b32	10	Damit können in Not geratene Tiere in kürzester Zeit aufgespürt werden .	Vögelbeschaffung	& Aussetzung . Für 4 Bartgeier übernahm der Zürcher Tierschutz die Patenschaft : Margunet ( * 1991 ) , Ivraina ( * 1992 ) , Felix ( * 1993 ) und Sina ( * 2008 ) .	Sg	Ind	Vogel	U	1
http://www.kitticat.de/archive/index.php/t-12457.html	6dbfd03d5c740a0fe7f7ff643eb2cb516f27	209	Wir haben auch mal einen Freigänger gehabt und der Stress mit den Nachbarn war wirklich grässlich . Leo hat bei denen Koi-Karpfen geangelt , er hat jeden Tag in das feine Kiesbett vor der Terrasse gekackt , er hat seine Mäuse - und	Vögelreste	bei denen liegenlassen ... er war nicht wirklich beliebt . Inzwischen wohnt er bei einer Freundin , sie wohnt ländlicher als wir .	Pl	Ind	Vogel	U	1
http://www.farben-welten.de/farben-welten/goethes-farbenlehre/historischer-teil/17-jahrhundert/isaac-vossius.html	b0ef65f14065423d39eee915e6ea98f27038	41	Was auch die Sonne mit ihren günstigen Strahlen bescheint , dieses nimmt sogleich eine angenehme und erfreuliche Färbung an . Findet sich auch in kalten Gegenden manchmal etwas Gefärbtes , so ist es doch nur selten und schwach und deutet mehr auf ein Bestreben einer abnehmenden Natur als ihre Macht und Gewalt an , wie denn ein einziges indisches Vögelchen eine größere Farbenmannigfaltigkeit leistet als das sämtliche	Vögelgeschlecht	, das norwegische und schwedische Wälder bevölkert . Ebenso verhält sich 's mit den übrigen Tieren , Pflanzen und Blumen ; denn in jenen Gegenden findest du nicht einmal die Täler mit leuchtenden und lebhaften Farben geschmückt , man müßte sie denn durch Kunst hervorbringen oder der Boden müßte von einer besondern Beschaffenheit sein .	Sg	Ind	Vogel	U	1
http://www.katzen-links.de/katzenforum2/archive/index.php/t-89254.html	1be9d93b63880aa870f777e4741daa526354	103	Wenn du es schaffst , ihr zu erklären , dass das nicht der Fall ist , wird sie sicher mit der zweiten Katze einverstanden sein . mel_s 21.03.2007 , 17:52 Hallo ! In meiner jetzigen Wohnung steht im Mietvertrag , dass Kleintierhaltung ( und da steht : Kleintierhaltung ist quasi alles das , was man in Käfigen hält : Terrarien , Aquarien ,	Vögelkäfige	) erlaubt ist und bei allem anderen die schriftliche Einverständnis der Hausverwaltung zu beantragen ist . Habe ich bei Kater Nr. 1 gemacht - war gar kein Problem .	Pl	Ind	Vogel	U	1
http://www.hs-augsburg.de/~harsch/germanica/Chronologie/19Jh/Droste/dro_44g6.html	337fba2ef48c46d925a912eb5ea129a4cf78	87	" Der Tod des Erzbischofs Engelbert von Cöln ( 1841 ) I Der Anger dampft , es kocht die Ruhr , Im scharfen Ost die Halme pfeifen , Da trabt es sachte durch die Flur , Da taucht es auf wie Nebelstreifen , 5 Da nieder rauscht es in den Fluß , Und stemmend gen der Wellen Guß Es fliegt der Bug , die Hufe greifen . Ein Schnauben noch , ein Satz , und frei Das Roß schwingt seine nassen Flanken , 10 Und wieder ein , und wieder zwei , Bis fünf und zwanzig stehn wie Schranken : Voran , voran durch Haid und Wald , Und wo sich wüst das Dickicht ballt , Da brechen knisternd sie die Ranken 15 Am Eichenstamm , im Ueberwind , Um einen Ast den Arm geschlungen , Der Isenburger steht und sinnt Und naget an Erinnerungen . Ob er vernimmt , was durch 's Gezweig 20 Ihm Rinkerad , der Ritter bleich , Raunt leise wie mit	Vögelzungen	? " Graf , " flüstert es , " Graf haltet dicht , Mich dünkt , als woll ' es euch bethören ; Bei Christi Blute , laßt uns nicht 25 Heim wie gepeitschte Hunde kehren Wer hat gefesselt eure Hand , Den freien Stegreif euch verrannt ?	Pl	Ind	Vogel	U	1
http://www.campodecriptana.de/blog/2005/04/10/107.html	41c4c6bc10ce89947f7b758d5bd460f1f886	47	Von mir aus , schlaft euch selber bei ! Und schlaft mit Drossel , Fink und Star und Brehms gesamter	Vögelschar	! Mir ist es einerlei .	Sg	Ind	Vogel	U	1
http://einfachnur.papstmaus.de/index.php?/archives/2007/12/P1.html	0f2f35e08cbd51e1b8efb1cc8c145919d01c	68	Da im Teich ein Loch ist und der Rest aus Eisdecke besteht , haben die kleinen Vögelchen das Wasser ausm Teich getrunken . Niedlich Den an allen anderen Wasserstellen waren	Vögeltapser	aber kein Wasser ... Und der doofe Mistmader war im Garten .	Pl	Ind	Vogel	U	1
http://www.eu-asien.de/Russland-Informationen/Uebersicht/Flora-Fauna.html	b7b2a89863239f6645247f5523fd58496171	65	Dort fühlt sich auch der so genannte Kamtschatka-Biber wohl . Auf Inseln und Felsen gibt es außerdem zahlreiche	Vögelkolonien	. Der Meeresküste nähern sich zudem häufig Bartenwale , Pottwale oder so genannte Mörderwale .	Pl	Coll	Vogel	U	1
http://www.vogel-portal.de/forum/archive/index.php?t-5778.html	ccac39f26a6f39476d0eb2bd2fcaaff162b7	2	Ich bin neu hier und brauche Euren Rat ! Nach dem Tot eines	Vögelfreundes	ist die Witwe mit den Tieren heillos überfordert , deshalb bin ich eingesprungen und suche nun für 23 Tauben ( Bunt gemischter Haufen ) ein gutes , neues Zuhause . Ich glaube nicht das die Tiere für Züchter in Frage kommen - es muss schon jemand mit einem großen Herz für Tauben sein , denn sie wollen auf keinen Fall in der Suppe landen !!	Pl	Ind	Vogel	U	1
http://www.schaedlingshotline.de/forum/schaedlingsbestimmung-bekaempfung-und-schaedlingsp-f2/fliegen-aus-der-dunstabzugshaube-t1510.html	3849c689d0656012623f79baa15e5de1f962	83	Den Dachdecker ( guter Freund von uns ) kommt nächste Woche mit einer langen Leiter vorbei und will mal in den Schornstein schauen . Muß ihnn auch mal fragen , ob man an den Schornstein	Vögelabwehr	anbringen kann . Die Tauben und Raben wecken mich nämlich morgens immer wenn sie auf ihm landen wollen und keinen richtigen halt auf dem Metall bekommen .	Sg	Ind	Vogel	U	1
http://forum.team-altenpflege.de/archive/index.php?t-2962.html	0a1bc81aa101a12b74910664eb63f35eeb91	100	naja , besser als nichts . 10.09.2006 , 18:43 Hi Karin Superbild - selbstgemacht ?? Gruß Doedl Gast Schwester Hildegard 10.09.2006 , 20:17 Hi , also bei uns gibt es auf jedem WB einen riesen	Vögelkäfig	in den Gemeinschaftsräumen . Auf den BW-Zimmern gibts keine Tiere .	Sg	Ind	Vogel	U	1
http://www.schwedenforum-neu.de/archive/index.php/t-4634.html	cbafe39bb915c1aed620e66f140e3f189dd1	41	Ich freu mich schon auf den 2. Teil . : p Ich hatte ja im letzten Schwedenurlaub auch	Vögeldiebe	, die meinen Dorsch stahlen . :p vBulletin® v 3.8.2 , Copyright © 2000 - 2011 , Jelsoft Enterprises Ltd . Kegelclub ManAcademy News Der Club Statistiken Galerie Forum Links Termine Unsere Boote Counter von Counter-Service 05.11.11 Kegelabend Hallo liebe Spackos des Kegelsports :D . Bevor ich großartig viele Worte über den unbeschreiblichen Abend verliere , möchte ich mich bei unseren Gastkeglern bedanken .	Pl	Ind	Vogel	U	1
